Nombre_Original,Nombre_Comparado,Similitud (%)
"COLEGIO""CENTRO DE FORMACIÓN PROFESIONAL PRE UNIVERSITARIA DEL CICLO DIVERSIFICADO","COLEGIO""CENTRO DE FORMACIÓN PROFESIONAL PREUNIVERSITARIA DEL CICLO DIVERSIFICADO",99.37888198757764
COLEGIO EDUCATIVO PRIVADO MIXTO DE FORMACIÓN INTEGRAL EN COMPUTACIÓN CEIF COMP,"COLEGIO EDUCATIVO PRIVADO MIXTO DE FORMACIÓN INTEGRAL EN COMPUTACIÓN, CEIF COMP",99.36305732484077
INSTITUTO TECNICO DE CAPACITACION Y PRODUCTIVIDAD INTECAP,"INSTITUTO TECNICO DE CAPACITACION Y PRODUCTIVIDAD, INTECAP",99.1304347826087
INSTITUTO TECNICO PARTICULAR DE DIVERSIFICADO INTECPADI,"INSTITUTO TECNICO PARTICULAR DE DIVERSIFICADO, INTECPADI",99.09909909909909
"PROGRAMA NACIONAL DE EDUCACIÓN ALTERNATIVA, PRONEA","PROGRAMA NACIONAL DE EDUCACIÓN ALTERNATIVA , PRONEA",99.00990099009901
INSTITUTO NACIONAL DE EDUCACION DIVERSIFICADA INED,"INSTITUTO NACIONAL DE EDUCACION DIVERSIFICADA, INED",99.00990099009901
CENTRO DE ESTUDIOS PREUNIVERSITARIOS CAHABON CEPREC,CENTRO DE ESTUDIOS PREUNIVERSITARIO CAHABON CEPREC,99.00990099009901
INSTITUTO NACIONAL DE EDUCACIÓN DIVERSIFICADA INED,"INSTITUTO NACIONAL DE EDUCACIÓN DIVERSIFICADA, INED",99.00990099009901
"PROGRAMA NACIONAL DE EDUCACION ALTERNATIVA, PRONEA",PROGRAMA NACIONAL DE EDUCACION ALTERNATIVA PRONEA,98.98989898989899
PROGRAMA NACIONAL DE EDUCACIÓN ALTERNATIVA PRONEA,"PROGRAMA NACIONAL DE EDUCACIÓN ALTERNATIVA, PRONEA",98.98989898989899
PROGRAMA NACIONAL DE EDUCACIÓN ALTERNATIVA PRONEA,PROGRAMA NACIONA DE EDUCACIÓN ALTERNATIVA PRONEA,98.96907216494846
CENTRO EDUCATIVO IMB PC EN LINEA (IMB PC ONLINE),"CENTRO EDUCATIVO IMB PC EN LINEA, (IMB PC ONLINE)",98.96907216494846
COLEGIO BILINGÜE DE COMPUTACIÓN C.B.C. EL CARMEN,COLEGIO BILINGÜE DE COMPUTACIÓN C.B.C EL CARMEN,98.94736842105263
CENTRO EDUCACIONAL DE CIENCIAS CONTABLES CECON,CENTRO EDUCACIONAL DE CIENCIAS CONTABLES CECCON,98.9247311827957
COLEGIO MIXTO PRE UNIVERSITARIO GALILEO GALILEI,COLEGIO MIXTO PREUNIVERSITARIO GALILEO GALILEI,98.9247311827957
CENTRO OFICIAL DE EDUCACIÓN EXTRAESCOLAR CEEX,CENTRO OFICIAL DE EDUCACIÓN EXTRAESCOLAR COEEX,98.9010989010989
INSTITIUTO PRIVADO MIXTO POR MADUREZ EL SABER,INSTITUTO PRIVADO MIXTO POR MADUREZ EL SABER,98.87640449438202
COLEGIO PARTICULAR MIXTO SAN JOSE OBRERO I,COLEGIO PARTICULAR MIXTO SAN JOSE OBRERO II,98.82352941176471
CENTRO DE ESTUDIOS TECNICOS Y AVANZADOS DE CHIMALTENANGO NO. 2 (C.E.T.A.CH. NO. 2),CENTRO DE ESTUDIOS TÉCNICOS Y AVANZADOS DE CHIMALTENANGO NO. 2 (C.E.T.A.CH. NO. 2),98.78048780487805
"INSTITUTO PARTICULAR MIXTO DE EDUCACION BÁSICA Y DIVERSIFICADA""DR. PEDRO MOLINA","INSTITUTO PARTICULAR MIXTO DE EDUCACIÓN BÁSICA Y DIVERSIFICADA""DR. PEDRO MOLINA",98.73417721518987
INSTITUTO PARTICULAR MIXTO DE EDUCACION BASICA Y DIVERSIFICADA DR. PEDRO MOLINA,"INSTITUTO PARTICULAR MIXTO DE EDUCACION BASICA Y DIVERSIFICADA""DR. PEDRO MOLINA",98.73417721518987
INSTITUTO PARTICULAR MIXTO DE EDUCACION BÁSICA Y DIVERSIFICADA DR. PEDRO MOLINA,INSTITUTO PARTICULAR MIXTO DE EDUCACION BASICA Y DIVERSIFICADA DR. PEDRO MOLINA,98.73417721518987
"INSTITUTO PARTICULAR MIXTO DE EDUCACION BÁSICA Y DIVERSIFICADA""DR. PEDRO MOLINA","INSTITUTO PARTICULAR MIXTO DE EDUCACION BASICA Y DIVERSIFICADA""DR. PEDRO MOLINA",98.73417721518987
"INSTITUTO PARTICULAR MIXTO DE EDUCACION BÁSICA Y DIVERSIFICADA""DR. PEDRO MOLINA",INSTITUTO PARTICULAR MIXTO DE EDUCACION BÁSICA Y DIVERSIFICADA DR. PEDRO MOLINA,98.73417721518987
INSTITUTO DE EDUCACIÓN BÁSICA Y DIVERSIFICADO PARA ADULTOS FUNDACIÓN PANTALEON,INSTITUTO DE EDUCACIÓN BÁSICA Y DIVERSIFICADO PARA ADULTOS FUNDACIÓN PANTALEÓN,98.71794871794873
INSTITUTO TÉCNICO EXPERIMENTAL DE FORMACIÓN INDUSTRIAL POR COOPERATIVA ITEFIC,INSTITUTO TECNICO EXPERIMENTAL DE FORMACIÓN INDUSTRIAL POR COOPERATIVA ITEFIC,98.7012987012987
"INSTITUTO NACIONAL DE EDUCACION DIVERSIFICADA""DOCTORA SARA CABARRUS DE RUÍZ","INSTITUTO NACIONAL DE EDUCACIÓN DIVERSIFICADA""DOCTORA SARA CABARRUS DE RUÍZ",98.66666666666667
CENTRO DE EDUCACION EXTRAESCOLAR CEEX,CENTRO DE EDUCACION EXTRA ESCOLAR CEEX,98.66666666666667
CENTRO EDUCATIVO PRIVADO MIXTO DE EDUCACION BÁSICA Y DIVERSIFICADO CEPMEBYD,CENTRO EDUCATIVO PRIVADO MIXTO DE EDUCACIÓN BÁSICA Y DIVERSIFICADO CEPMEBYD,98.66666666666667
"INSTITUTO PRIVADO DE EDUCACIÓN DE CIENCIAS Y TECNOLOGIA""LA SAGRADA FAMILIA","INSTITUTO PRIVADO DE EDUCACIÓN DE CIENCIAS Y TECNOLOGÍA""LA SAGRADA FAMILIA",98.64864864864865
"INSTITUTO PRIVADO DE EDUCACION DE CIENCIAS Y TECNOLOGIA""LA SAGRADA FAMILIA","INSTITUTO PRIVADO DE EDUCACIÓN DE CIENCIAS Y TECNOLOGIA""LA SAGRADA FAMILIA",98.64864864864865
INSTITUTO PARTICULAR MIXTO DE FORMACIÓN Y DESARROLLO PROFESIONAL INDEFORP,"INSTITUTO PARTICULAR MIXTO DE FORMACIÓN Y DESARROLLO PROFESIONAL""INDEFORP",98.63013698630137
INSTITUTO TECNOLÓGICO DE LA UNIVERSIDAD DEL VALLE DE GUATEMALA ALTIPLANO,INSTITUTO TECNOLOGICO DE LA UNIVERSIDAD DEL VALLE DE GUATEMALA ALTIPLANO,98.61111111111111
CENTRO EDUCATIVO FE Y ALEGRIA NO. 1,CENTRO EDUCATIVO FE Y ALEGRIA NO. 14,98.59154929577466
INSTITUTO MIXTO DE EDUCACION DIVERSIFICADA POR COOPERATIVA DE ENSEÑANZA,INSTITUTO MIXTO DE EDUCACIÓN DIVERSIFICADA POR COOPERATIVA DE ENSEÑANZA,98.59154929577466
"COLEGIO CRISTIANO MIXTO""HISPANOAMERICANO""CON ORIENTACION EN COMPUTACIÓN","COLEGIO CRISTIANO MIXTO""HISPANOAMERICANO""CON ORIENTACIÓN EN COMPUTACIÓN",98.59154929577466
"INSTITUTO DIVERSIFICADO POR EL SISTEMA DE COOPERATIVA""LICEO FRATERNIDAD",INSTITUTO DIVERSIFICADO POR EL SISTEMA DE COOPERATIVA LICEO FRATERNIDAD,98.59154929577466
COLEGIO EDUCATIVO DE DESARROLLO INFORMATICO Y CIENTIFICO DE AMATITLAN,COLEGIO EDUCATIVO DE DESARROLLO INFORMATICO Y CIENTIFICO DE AMATITLÁN,98.55072463768117
ESCUELA NORMAL BILINGÜE INTERCULTURAL JAXNAQTZAL MAM KYE AJXNAQTZAL,ESCUELA NORMAL BILINGÜE INTERCULTURAL JAXNAQ TZAL MAM KYE AJXNAQ TZAL,98.52941176470588
"ESCUELA EXPERIMENTAL CON ORIENTACION OCUPACIONAL""VILLA DE LOS NIÑOS",ESCUELA EXPERIMENTAL CON ORIENTACION OCUPACIONAL VILLA DE LOS NIÑOS,98.50746268656717
"ESCUELA EXPERIMENTAL CON ORIENTACIÓN OCUPACIONAL""VILLA DE LOS NIÑOS","ESCUELA EXPERIMENTAL CON ORIENTACION OCUPACIONAL""VILLA DE LOS NIÑOS",98.50746268656717
LICEO DE COMPUTACIÓN C.S.S. ZONA 7,LICEO DE COMPUTACIÓN C.S.S ZONA 7,98.50746268656717
"CENTRO EDUCATIVO INTEGRAL,""FAGIOLI","CENTRO EDUCATIVO INTEGRAL""FAGIOLI",98.50746268656717
"CENTRO EDUCATIVO CRISTIANO CON ORIENTACION UNIVERSITARIA""EL SHADDAI",CENTRO EDUCATIVO CRISTIANO CON ORIENTACION UNIVERSITARIA EL SHADDAI,98.50746268656717
INSTITUTO DE EDUCACION DIVERSIFICADA POR COOPERATIVA DE ENSEÑANZA,INSTITUTO DE EDUCACIÓN DIVERSIFICADA POR COOPERATIVA DE ENSEÑANZA,98.46153846153847
INSTITUTO TECNOLÓGICO EN EDUCACION INTEGRAL MIXCO A LA VANGUARDIA,INSTITUTO TECNOLÓGICO EN EDUCACIÓN INTEGRAL MIXCO A LA VANGUARDIA,98.46153846153847
INSTITUTO MUNICIPAL DE EDUCACIÓN MEDIA Y BACHILLERATO POR MADUREZ,INSTITUTO MUNICIPAL DE EDUCACION MEDIA Y BACHILLERATO POR MADUREZ,98.46153846153847
COLEGIO EVANGÉLICO TECNOLÓGICO PRIVADO MIXTO BERSHEBA BLESS GOD,COLEGIO EVANGÉLICO TECNOLOGICO PRIVADO MIXTO BERSHEBA BLESS GOD,98.41269841269842
INSTITUTO TECNOLOGICO VOCACIONAL MARCO TULIO DE LA CRUZ MORALES,"INSTITUTO TECNOLOGICO VOCACIONAL""MARCO TULIO DE LA CRUZ MORALES",98.41269841269842
INSTITUTO TECNOLOGICO VOCACIONAL MARCO TULIO DE LA CRUZ MORALES,INSTITUTO TECNOLÓGICO VOCACIONAL MARCO TULIO DE LA CRUZ MORALES,98.41269841269842
COLEGIO EVANGÉLICO DE ESTUDIOS INTEGRADOS SAN SEBASTIÁN CEEDISS,COLEGIO EVANGÉLICO DE ESTUDIOS INTEGRADOS SAN SEBASTIAN CEEDISS,98.41269841269842
LICEO PREUNIVERSITARIO DE NORTE,LICEO PREUNIVERSITARIO DEL NORTE,98.41269841269842
"INSTITUTO TECNOLOGICO VOCACIONAL""MARCO TULIO DE LA CRUZ MORALES","INSTITUTO TECNOLÓGICO VOCACIONAL""MARCO TULIO DE LA CRUZ MORALES",98.41269841269842
"INSTITUTO TECNOLÓGICO VOCACIONAL""MARCO TULIO DE LA CRUZ MORALES",INSTITUTO TECNOLÓGICO VOCACIONAL MARCO TULIO DE LA CRUZ MORALES,98.41269841269842
INSTITUTO PRIVADO MIXTO DE EDUCACION DIVERSIFICADA HUMANIDADES,"INSTITUTO PRIVADO MIXTO DE EDUCACION DIVERSIFICADA""HUMANIDADES",98.38709677419355
COLEGIO PARROQUIAL PRIVADO MIXTO SANTA TERESITA DEL NIÑO JESÚS,"COLEGIO PARROQUIAL PRIVADO MIXTO""SANTA TERESITA DEL NIÑO JESÚS",98.38709677419355
"INSTITUTO PRIVADO MIXTO DE BACHILLERATO POR MADUREZ""COATEPEQUE",INSTITUTO PRIVADO MIXTO DE BACHILLERATO POR MADUREZ COATEPEQUE,98.38709677419355
"COLEGIO PARTICULAR MIXTO DE DIVERSIFICADO""LICEO SAN CRISTOBAL",COLEGIO PARTICULAR MIXTO DE DIVERSIFICADO LICEO SAN CRISTOBAL,98.36065573770492
CENTRO EDUCATIVO DE ESTUDIOS INTEGRADOS SAN SEBASTIAN CEEDISS,CENTRO EDUCATIVO DE ESTUDIOS INTEGRADOS SAN SEBASTIÁN CEEDISS,98.36065573770492
"COLEGIO PRIVADO MIXTO""IMPERIAL","COLEGIO PRIVADO MIXTO""IMPERIAL2",98.36065573770492
"INSTITUTO PARTICULAR MIXTO INTERCULTURAL""CIENCIA Y DESARROLLO",INSTITUTO PARTICULAR MIXTO INTERCULTURAL CIENCIA Y DESARROLLO,98.36065573770492
"INSTITUTO PRIVADO URBANO MIXTO TÉCNICO EN COMPUTACIÓN""ITCRB","INSTITUTO PRIVADO URBANO MIXTO TECNICO EN COMPUTACIÓN""ITCRB",98.30508474576271
ESCUELA PRIVADA MIXTA DE FORMACIÓN ARTÍSTICA QUETZALTENANGO,ESCUELA PRIVADA MIXTA DE FORMACIÓN ARTISTICA QUETZALTENANGO,98.30508474576271
"COLEGIO EDUCATIVO""LICDA. KIMBERLY MAZARIEGOS ENRÍQUEZ NO. 1","COLEGIO EDUCATIVO""LICDA. KIMBERLY MAZARIEGOS ENRÍQUEZ NO. 2",98.30508474576271
INSTITUTO TÉCNICO INDUSTRIAL PARA VARONES DE QUETZALTENANGO,INSTITUTO TECNICO INDUSTRIAL PARA VARONES DE QUETZALTENANGO,98.30508474576271
INSTITUTO MIXTO DE EDUCACIÓN DIVERSIFICADA POR COOPERATIVA,INSTITUTO MIXTO DE EDUCACION DIVERSIFICADA POR COOPERATIVA,98.27586206896551
"INSTITUTO COMUNITARIO DE CIENCIAS COMERCIALES""EL ALTIPLANO",INSTITUTO COMUNITARIO DE CIENCIAS COMERCIALES EL ALTIPLANO,98.27586206896551
INSTITUTO TECNICO DE CAPACITACIÓN Y PRODUCTIVIDAD INTECAP,INSTITUTO TECNICO DE CAPACITACION Y PRODUCTIVIDAD INTECAP,98.24561403508771
INSTITUTO TÉCNICO DE CAPACITACIÓN Y PRODUCTIVIDAD INTECAP,INSTITUTO TECNICO DE CAPACITACIÓN Y PRODUCTIVIDAD INTECAP,98.24561403508771
TECNOLOGICO PREUNIVERSITARIO,TECNOLOGICO PRE UNIVERSITARIO,98.24561403508771
"CENTRO DE ESTUDIOS DE INGENIERIA Y ARQUITECTURA""REMBRANDT",CENTRO DE ESTUDIOS DE INGENIERIA Y ARQUITECTURA REMBRANDT,98.24561403508771
INSTITUTO MIXTO DE EDUCACION BILINGÜE INTERCULTURAL IMEBI,INSTITUTO MIXTO DE EDUCACIÓN BILINGÜE INTERCULTURAL IMEBI,98.24561403508771
"COLEGIO PRIVADO MIXTO""ELOHIM","COLEGIO PRIVADO MIXTO""ELHOHIM",98.24561403508771
"COLEGIO EJECUTIVO PRE UNIVERSITARIO EN COMPUTACIÓN""CLASSE",COLEGIO EJECUTIVO PRE UNIVERSITARIO EN COMPUTACIÓN CLASSE,98.24561403508771
INSTITUTO DE EDUCACION A DISTANCIA LA ESCUELA EN SU CASA,"INSTITUTO DE EDUCACION A DISTANCIA""LA ESCUELA EN SU CASA",98.21428571428571
"INSTITUTO DE EDUCACIÓN A DISTANCIA""LA ESCUELA EN SU CASA","INSTITUTO DE EDUCACION A DISTANCIA""LA ESCUELA EN SU CASA",98.21428571428571
"LICEO CRISTIANO CON ORIENTACIÓN UNIVERSITARIA""EL SHADDAI","LICEO CRISTIANO CON ORIENTACION UNIVERSITARIA""EL SHADDAI",98.21428571428571
"COLEGIO PARTICULAR MIXTO""CENTRO INTEGRAL SISTEMATICO CIS","COLEGIO PARTICULAR MIXTO""CENTRO INTEGRAL SISTEMÁTICO CIS",98.21428571428571
INSTITUTO MUNICIPAL DE EDUCACIÓN BÁSICA Y DIVERSIFICADA,INSTITUTO MUNICIPAL DE EDUCACIÓN BÁSICA Y DIVERSIFICADO,98.18181818181819
INSTITUTO MUNICIPAL DE DIVERSIFICADO POCHUTA CENTENARIO,"INSTITUTO MUNICIPAL DE DIVERSIFICADO""POCHUTA CENTENARIO",98.18181818181819
INSTITUTO TECNICO PARTICULAR DE DIVERSIFICADO INTECPADI,INSTITUTO TÉCNICO PARTICULAR DE DIVERSIFICADO INTECPADI,98.18181818181819
"CENTRO EDUCATIVO INTEGRAL""MANANTIAL DE SABIDURIA CEIMSA",CENTRO EDUCATIVO INTEGRAL MANANTIAL DE SABIDURIA CEIMSA,98.18181818181819
"CENTRO DE EDUCACION EXTRAESCOLAR""ESCUELA DE CAFICULTURA","CENTRO DE EDUCACIÓN EXTRAESCOLAR""ESCUELA DE CAFICULTURA",98.18181818181819
"INSTITUTO TECNOLOGICO PRIVADO DE SANTA ROSA""CRISTO VIVE","INSTITUTO TECNOLÓGICO PRIVADO DE SANTA ROSA""CRISTO VIVE",98.18181818181819
"LICEO DE FORMACIÓN BASICA Y PROFESIONAL""LATINOAMERICANO",LICEO DE FORMACIÓN BASICA Y PROFESIONAL LATINOAMERICANO,98.18181818181819
INSTITUTO TECNOLOGICO PRIVADO MIXTO EVANGÉLICO SUNESIS,INSTITUTO TECNOLÓGICO PRIVADO MIXTO EVANGÉLICO SUNESIS,98.14814814814815
INSTITUTO NACIONAL DE EDUCACION BÁSICA Y DIVERSIFICADA,INSTITUTO NACIONAL DE EDUCACION BASICA Y DIVERSIFICADA,98.14814814814815
INSTITUTO TECNOLOGICO PRIVADO MIXTO EVANGÉLICO SUNESIS,"INSTITUTO TECNOLOGICO PRIVADO MIXTO EVANGÉLICO""SUNESIS",98.14814814814815
"INSTITUTO PRIVADO MIXTO DE FORMACIÓN JUVENIL""RIO DULCE","INSTITUTO PRIVADO MIXTO DE FORMACIÓN JUVENIL""RÍO DULCE",98.14814814814815
CENTRO DE APRENDIZAJES ISOS,CENTRO DE APRENDIZAJE ISOS,98.11320754716981
INSTITUTO TÉCNICO DIVERSIFICADO ASOCIATIVA AJ YICHKAN,INSTITUTO TECNICO DIVERSIFICADO ASOCIATIVA AJ YICHKAN,98.11320754716981
"INSTITUTO TÉCNICO DIVERSIFICADO ASOCIATIVA""AJ YICHKAN",INSTITUTO TÉCNICO DIVERSIFICADO ASOCIATIVA AJ YICHKAN,98.11320754716981
"COLEGIO DE EDUCACION INTEGRAL CON ORIENTACION UNIVERSITARIA,""EL PODER DEL SABER",COLEGIO DE EDUCACION INTEGRAL CON ORIENTACION UNIVERSITARIA EL PODER DEL SABER,98.08917197452229
COLEGIO PARTICULAR MIXTO FRAY BARTOLOME DE LAS CASAS,COLEGIO PARTICULAR MIXTO FRAY BARTOLOMÉ DE LAS CASAS,98.07692307692307
"COLEGIO BILINGÜE CRISTIANO""EL ÁRBOL DEL CONOCIMIENTO",COLEGIO BILINGÜE CRISTIANO EL ÁRBOL DEL CONOCIMIENTO,98.07692307692307
INSTITUTO NACIONAL MIXTO NOCTURNO DE EDUCACION MEDIA,INSTITUTO NACIONAL MIXTO NOCTURNO DE EDUCACIÓN MEDIA,98.07692307692307
"INSTITUTO MIXTO DE EDUCACIÓN MUNICIPAL""VALLE DEL SOL","INSTITUTO MIXTO DE EDUCACION MUNICIPAL""VALLE DEL SOL",98.07692307692307
"INSTITUTO PRIVADO URBANO MIXTO""TECNOLOGICO HUMANISTA",INSTITUTO PRIVADO URBANO MIXTO TECNOLOGICO HUMANISTA,98.07692307692307
INSTITUTO DE EDUCACION DIVERSIFICADA POR COOPERATIVA,INSTITUTO DE EDUCACION DIVERSIFICADO POR COOPERATIVA,98.07692307692307
INSTITUTO MIXTO MUNICIPAL DE EDUCACION DIVERSIFICADA,INSTITUTO MIXTO MUNICIPAL DE EDUCACION DIVERSIFICADO,98.07692307692307
INSTITUTO MIXTO MUNICIPAL DE EDUCACION DIVERSIFICADA,INSTITUTO MIXTO MUNICIPAL DE EDUCACIÓN DIVERSIFICADA,98.07692307692307
INSTITUTO DE EDUCACIÓN DIVERSIFICADA POR COOPERATIVA,INSTITUTO DE EDUCACION DIVERSIFICADA POR COOPERATIVA,98.07692307692307
INSTITUTO DE EDUCACION DIVERSIFICADA RAFAEL LANDIVAR,"INSTITUTO DE EDUCACION DIVERSIFICADA""RAFAEL LANDIVAR",98.07692307692307
"INSTITUTO NACIONAL DE EDUCACION DIVERSIFICADA, INED","INSTITUTO NACIONAL DE EDUCACIÓN DIVERSIFICADA, INED",98.0392156862745
COLEGIO CRISTIANO EMMANUEL,COLEGIO CRISTIANO EMANUEL,98.0392156862745
COLEGIO TECNOLÓGICO CENTRO CULTURAL DE LAS AMÉRICAS,COLEGIO TECNOLÓGICO CENTRO CULTURAL DE LAS AMERICAS,98.0392156862745
INSTITUTO PARTICULAR MIXTO JOSE MARIA BONILLA RUANO,"INSTITUTO PARTICULAR MIXTO""JOSE MARIA BONILLA RUANO",98.0392156862745
"COLEGIO MIXTO""INDO LATINO","COLEGIO MIXTO""INDO LATINO¨",98.0392156862745
CENTRO DE EDUCACIÓN EXTRAESCOLAR CEEX DEPARTAMENTAL,CENTRO DE EDUCACION EXTRAESCOLAR CEEX DEPARTAMENTAL,98.0392156862745
INSTITUTO NACIONAL DE EDUCACION DIVERSIFICADA INED,INSTITUTO NACIONAL DE EDUCACION DIVERSIFICADO INED,98.0
INSTITUTO NACIONAL DE EDUCACION DIVERSIFICADA INED,INSTITUTO NACIONAL DE EDUCACIÓN DIVERSIFICADA INED,98.0
"PROGRAMA NACIONAL DE EDUCACIÓN ALTERNATIVA, PRONEA","PROGRAMA NACIONAL DE EDUCACION ALTERNATIVA, PRONEA",98.0
COLEGIO PRIVADO MIXTO NUESTRA SEÑORA DE CONCEPCION,COLEGIO PRIVADO MIXTO NUESTRA SEÑORA DE CONCEPCIÓN,98.0
COLEGIO MIXTO DE EDUCACIÓN MEDIA CMEM EL INNOVADOR,"COLEGIO MIXTO DE EDUCACIÓN MEDIA CMEM""EL INNOVADOR",98.0
LICEO PREUNIVERSITARIO DE INFORMÁTICA Y TECNOLOGÍA,LICEO PREUNIVERSITARIO DE INFORMÁTICA Y TECNOLOGIA,98.0
"COLEGIO PREUNIVERSITARIO DEL SUR""DOMINGO DE GUZMAN","COLEGIO PREUNIVERSITARIO DEL SUR""DOMINGO DE GUZMÁN",98.0
COLEGIO MIXTO DE EDUCACIÓN MEDIA CMEM EL INNOVADOR,COLEGIO MIXTO DE EDUCACION MEDIA CMEM EL INNOVADOR,98.0
"INSTITUTO PRIVADO MIXTO DIVERSIFICADO""JACALTENANGO",INSTITUTO PRIVADO MIXTO DIVERSIFICADO JACALTENANGO,98.0
"COLEGIO DE INNOVACIÓN Y APRENDIZAJE TECULUTÁN""CIAT","COLEGIO DE INNOVACION Y APRENDIZAJE TECULUTÁN""CIAT",98.0
CENTRO DE ESTUDIOS PREUNIVERSITARIO CAHABÓN CEPREC,CENTRO DE ESTUDIOS PREUNIVERSITARIO CAHABON CEPREC,98.0
PROGRAMA NACIONAL DE EDUCACIÓN ALTERNATIVA PRONEA,"PROGRAMA NACIONAL DE EDUCACIÓN ALTERNATIVA , PRONEA",98.0
"LICEO TECNOLÓGICO BILINGÜE""CUAUHTEMALLAN DE SOLOLA","LICEO TECNOLÓGICO BILINGÜE""CUAUHTEMALLAN DE SOLOLÁ",98.0
PROGRAMA NACIONAL DE EDUCACIÓN ALTERNATIVA PRONEA,PROGRAMA NACIONAL DE EDUCACION ALTERNATIVA PRONEA,97.95918367346938
"COLEGIO DE EDUCACIÓN PARA ADULTOS""SEMILLA DE VIDA","COLEGIO DE EDUCACION PARA ADULTOS""SEMILLA DE VIDA",97.95918367346938
"PROGRAMA NACIONAL DE EDUCACIÓN ALTERNATIVA, PRONEA",PROGRAMA NACIONA DE EDUCACIÓN ALTERNATIVA PRONEA,97.95918367346938
CENTRO DE INTEGRACIÓN DE TÉCNICAS EDUCATIVAS CITE,CENTRO DE INTEGRACION DE TÉCNICAS EDUCATIVAS CITE,97.95918367346938
INSTITUTO TECNICO INDUSTRIAL PRIVADO DE TIQUISATE,INSTITUTO TÉCNICO INDUSTRIAL PRIVADO DE TIQUISATE,97.95918367346938
INSTITUTO TÉCNICO VOCACIONAL PRIVADO AMATITLANECO,INSTITUTO TECNICO VOCACIONAL PRIVADO AMATITLANECO,97.95918367346938
"INSTITUTO MIXTO MUNICIPAL""MARÍA FLORENCIA ARTEAGA",INSTITUTO MIXTO MUNICIPAL MARÍA FLORENCIA ARTEAGA,97.95918367346938
COLEGIO HISPANOAMERICANO,COLEGIO HISPANO AMERICANO,97.95918367346938
"INSTITUTO TECNOLOGICO PARTICULAR MIXTO""CONCEPCION",INSTITUTO TECNOLOGICO PARTICULAR MIXTO CONCEPCION,97.95918367346938
"COLEGIO CRISTIANO PREUNIVERSITARIO""EL REFORMADOR","COLEGIO CRISTIANO PREUNIVERSITARIO""EL REFORMADOS",97.91666666666666
CENTRO EDUCATIVO IMB PC EN LINEA (IMB PC ONLINE),CENTRO EDUCATIVO IMB PC EN LÍNEA (IMB PC ONLINE),97.91666666666666
INSTITUTO TECNICO INDUSTRIAL ZARAGOZA DE HEREDIA,INSTITUTO TÉCNICO INDUSTRIAL ZARAGOZA DE HEREDIA,97.91666666666666
COLEGIO MIXTO PRIVADO SAN PEDRO MARTIR DE VERONA,"COLEGIO MIXTO PRIVADO""SAN PEDRO MARTIR DE VERONA",97.91666666666666
COLEGIO PRIVADO MIXTO TECNOLÓGICO EN INFORMÁTICA,COLEGIO PRIVADO MIXTO TECNOLOGICO EN INFORMÁTICA,97.91666666666666
"COLEGIO""LICEO INTEGRAL CIENTIFICO EN COMPUTACIÓN",COLEGIO LICEO INTEGRAL CIENTIFICO EN COMPUTACIÓN,97.91666666666666
"COLEGIO BILINGÜE DE COMPUTACIÓN C.B.C.""EL CARMEN",COLEGIO BILINGÜE DE COMPUTACIÓN C.B.C. EL CARMEN,97.91666666666666
"COLEGIO DE ESTUDIOS SUPERIORES COMITANCILLO""CESC",COLEGIO DE ESTUDIOS SUPERIORES COMITANCILLO CESC,97.91666666666666
"INSTITUTO DE EDUCACIÓN DIVERSIFICADA POR EL SISTEMA DE COOPERATIVA DE SEÑANZA""CESAR PAULA MAES","INSTITUTO DE EDUCACION DIVERSIFICADA POR EL SISTEMA DE COOPERATIVA DE ENSEÑANZA""CESAR PAULA MAES",97.89473684210527
"INSTITUTO PARTICULAR MIXTO""CIENCIA Y DESARROLLO",INSTITUTO PARTICULAR MIXTO CIENCIA Y DESARROLLO,97.87234042553192
INSTITUTO TECNOLÓGICO DE COMPUTACIÓN DE ORIENTE,INSTITUTO TECNOLOGICO DE COMPUTACIÓN DE ORIENTE,97.87234042553192
"COLEGIO PARROQUIAL""NUESTRA SEÑORA DE CANDELARIA",COLEGIO PARROQUIAL NUESTRA SEÑORA DE CANDELARIA,97.87234042553192
CENTRO EDUCACINAL DE CIENCIAS CONTABLES. CECCON,CENTRO EDUCACIONAL DE CIENCIAS CONTABLES CECCON,97.87234042553192
"CENTRO DE ESTUDIOS PREUNIVERSITARIOS""MONTE SION",CENTRO DE ESTUDIOS PREUNIVERSITARIOS MONTE SION,97.87234042553192
COLEGIO CRISTIANO GENERACION DEL TERCER MILENIO,COLEGIO CRISTIANO GENERACIÓN DEL TERCER MILENIO,97.87234042553192
ESCUELA NACIONAL DE FORMACIÓN SECRETARIAL NO. 4,ESCUELA NACIONAL DE FORMACIÓN SECRETARIAL NO. 3,97.87234042553192
COLEGIO PRIVADO MIXTO NUESTRA SEÑORA DEL CARMEN,"COLEGIO PRIVADO MIXTO""NUESTRA SEÑORA DEL CARMEN",97.87234042553192
CENTRO DE ESTUDIOS INTEGRADOS TECNOLÓGICO NEBAJ,CENTRO DE ESTUDIOS INTEGRADOS TECNOLOGICO NEBAJ,97.87234042553192
ESCUELA NACIONAL DE FORMACIÓN SECRETARIAL NO. 2,ESCUELA NACIONAL DE FORMACIÓN SECRETARIAL NO. 4,97.87234042553192
ESCUELA NACIONAL DE FORMACIÓN SECRETARIAL NO. 2,ESCUELA NACIONAL DE FORMACIÓN SECRETARIAL NO. 3,97.87234042553192
"CENTRO EDUCATIVO""RABI ANIBAL E. ALVAREZ MORALES","CENTRO EDUCATIVO""RABÍ ANIBAL E. ALVAREZ MORALES",97.87234042553192
LICEO PRIVADO MIXTO CENTROAMERICANO HUEHUETECO,"LICEO PRIVADO MIXTO""CENTROAMERICANO HUEHUETECO",97.82608695652173
ESCUELA NACIONAL DE CIENCIAS COMERCIALES NO. 5,ESCUELA NACIONAL DE CIENCIAS COMERCIALES NO. 3,97.82608695652173
ESCUELA NACIONAL DE CIENCIAS COMERCIALES NO. 2,ESCUELA NACIONAL DE CIENCIAS COMERCIALES NO. 5,97.82608695652173
ESCUELA NACIONAL DE CIENCIAS COMERCIALES NO. 2,ESCUELA NACIONAL DE CIENCIAS COMERCIALES NO. 3,97.82608695652173
"LICEO PROFESIONAL DE COMPUTACIÓN""MANUEL GALICH",LICEO PROFESIONAL DE COMPUTACIÓN MANUEL GALICH,97.82608695652173
"COLEGIO PARTICULAR MIXTO""MIGUEL ANGEL ASTURIAS","COLEGIO PARTICULAR MIXTO""MIGUEL ÁNGEL ASTURIAS",97.82608695652173
"INSTITUTO PRIVADO MIXTO""JOSE CECILIO DEL VALLE",INSTITUTO PRIVADO MIXTO JOSE CECILIO DEL VALLE,97.82608695652173
"INSTITUTO PRIVADO MIXTO""JOSÉ CECILIO DEL VALLE","INSTITUTO PRIVADO MIXTO""JOSE CECILIO DEL VALLE",97.82608695652173
INSTITUTO PRIVADO MIXTO EDUCACION Y DESARROLLO,"INSTITUTO PRIVADO MIXTO""EDUCACION Y DESARROLLO",97.82608695652173
INSTITUTO TECNOLÓGICO DIGITALES COMERCIALES II,INSTITUTO TECNOLOGICO DIGITALES COMERCIALES II,97.82608695652173
"INSTITUTO TECNICO PRIVADO""JOSE ORTEGA Y GASSET",INSTITUTO TECNICO PRIVADO JOSE ORTEGA Y GASSET,97.82608695652173
INSTITUTO MUNICIPAL DE EDUCACIÓN DIVERSIFICADA,INSTITUTO MUNICIPAL DE EDUCACION DIVERSIFICADA,97.82608695652173
"COLEGIO PARTICULAR MIXTO""MIGUEL ANGEL ASTURIAS",COLEGIO PARTICULAR MIXTO MIGUEL ANGEL ASTURIAS,97.82608695652173
INSTITUTO NACIONAL DE EDUCACIÓN DIVERSIFICADA,INSTITUTO NACIONAL DE EDUCACIÒN DIVERSIFICADA,97.77777777777777
"INSTITUTO PRIVADO MIXTO VESPERTINO""PROF. JOSE OTILIO FLORES CARBAJAL","INSTITUTO PRIVADO MIXTO VESPERTINO""PROF JOSÉ OTILIO FLORES CARBAJAL",97.77777777777777
INSTITUTO NACIONAL DE EDUCACIÓN DIVERSIFICADA,INSTITUTO NACIONAL DE EDUCACIÓN DIVERSIFICADO,97.77777777777777
LICEO PROFESIONAL DE INFORMÁTICA Y TECNOLOGÍA,LICEO PROFESIONAL DE INFORMÁTICA Y TECNOLOGIA,97.77777777777777
"INSTITUTO MIXTO DE EDUCACION FUNDAMENTAL""IMEF",INSTITUTO MIXTO DE EDUCACION FUNDAMENTAL IMEF,97.77777777777777
"COLEGIO EDUCATIVO MIXTO ÁNGEL DE JEHOVA""CEMAJ","COLEGIO EDUCATIVO MIXTO ÁNGEL DE JEHOVÁ""CEMAJ",97.77777777777777
"INSTITUTO PRIVADO MIXTO EVANGÉLICO""LOS OLIVOS",INSTITUTO PRIVADO MIXTO EVANGÉLICO LOS OLIVOS,97.77777777777777
LICEO MIXTO TÉCNICO EN COMPUTACIÓN SENDA 2000,LICEO MIXTO TECNICO EN COMPUTACIÓN SENDA 2000,97.77777777777777
INSTITUTO NACIONAL DE EDUCACION DIVERSIFICADA,INSTITUTO NACIONAL DE EDUCACIÒN DIVERSIFICADA,97.77777777777777
"LICEO MIXTO TECNICO EN COMPUTACIÓN""SENDA 2000",LICEO MIXTO TECNICO EN COMPUTACIÓN SENDA 2000,97.77777777777777
COLEGIO TECNOLÓGICO BILINGÜE EL HERMANO PEDRO,COLEGIO TECNOLOGICO BILINGÜE EL HERMANO PEDRO,97.77777777777777
INSTITUTO NACIONAL DE EDUCACION DIVERSIFICADA,INSTITUTO NACIONAL DE EDUCACION DIVERSIFICADO,97.77777777777777
INSTITUTO NACIONAL DE EDUCACION DIVERSIFICADO,INSTITUTO NACIONAL DE EDUCACIÓN DIVERSIFICADO,97.77777777777777
INSTITUTO NACIONAL DE EDUCACION DIVERSIFICADA,INSTITUTO NACIONAL DE EDUCACIÓN DIVERSIFICADA,97.77777777777777
COLEGIO PARTICULAR MIXTO TINTECO MARÍA TERESA,"COLEGIO PARTICULAR MIXTO TINTECO""MARÍA TERESA",97.77777777777777
"COLEGIO PRIVADO URBANO MIXTO""BILINGÜE PARAISO",COLEGIO PRIVADO URBANO MIXTO BILINGÜE PARAISO,97.77777777777777
INSTITUTO INDIGENA NUESTRA SEÑORA DEL SOCORRO,"INSTITUTO INDIGENA""NUESTRA SEÑORA DEL SOCORRO",97.77777777777777
"COLEGIO PRIVADO URBANO MIXTO""BILINGÜE PARAÍSO","COLEGIO PRIVADO URBANO MIXTO""BILINGÜE PARAISO",97.77777777777777
COLEGIO PARTICULAR MIXTO TINTECO MARÍA TERESA,COLEGIO PARTICULAR MIXTO TINTECO MARIA TERESA,97.77777777777777
COLEGIO PRIVADO MIXTO SANTA MARIA DEL CAMINO,"COLEGIO PRIVADO MIXTO""SANTA MARIA DEL CAMINO",97.72727272727273
"CENTRO DE ESTUDIOS""TECNICO JUVENIL EDUCATIVO",CENTRO DE ESTUDIOS TECNICO JUVENIL EDUCATIVO,97.72727272727273
"COLEGIO PARTICULAR MIXTO""LICEO NUEVO MILENIO",COLEGIO PARTICULAR MIXTO LICEO NUEVO MILENIO,97.72727272727273
"COLEGIO PARTICULAR MIXTO BILINGÜE""VILLA REAL",COLEGIO PARTICULAR MIXTO BILINGÜE VILLA REAL,97.72727272727273
"COLEGIO CRISTIANO PRIVADO MIXTO""CRISTO VIENE",COLEGIO CRISTIANO PRIVADO MIXTO CRISTO VIENE,97.72727272727273
"CENTRO DE ESTUDIOS""TECNICO JUVENIL EDUCATIVO","CENTRO DE ESTUDIOS""TÉCNICO JUVENIL EDUCATIVO",97.72727272727273
"INSTITUTO TECNICO INDUSTRIAL""ALBERT EINSTEIN",INSTITUTO TECNICO INDUSTRIAL ALBERT EINSTEIN,97.72727272727273
"INSTITUTO TECNICO INDUSTRIAL""ALBERT EINSTEIN","INSTITUTO TÉCNICO INDUSTRIAL""ALBERT EINSTEIN",97.72727272727273
"COLEGIO DE ESTUDIOS SUPERIORES SIPACAPA""CESS",COLEGIO DE ESTUDIOS SUPERIORES SIPACAPA CESS,97.72727272727273
COLEGIO PRIVADO MIXTO TECNOLÓGICO DON BOSCO,COLEGIO PRIVADO MIXTO TECNOLOGICO DON BOSCO,97.67441860465115
CENTRO TECNOLÓGICO DE COMPUTACIÓN LA MERCED,CENTRO TECNOLOGICO DE COMPUTACIÓN LA MERCED,97.67441860465115
"COLEGIO PARTICULAR MIXTO""SAN JOSÉ OBRERO II","COLEGIO PARTICULAR MIXTO""SAN JOSE OBRERO II",97.67441860465115
ESCUELA EN CIENCIAS DE LA COMUNICACIÓN ECCO,ESCUELA EN CIENCIAS DE LA COMUNICACION ECCO,97.67441860465115
INSTITUTO TECNOLOGICO PRIVADO DE COATEPEQUE,INSTITUTO TECNOLÓGICO PRIVADO DE COATEPEQUE,97.67441860465115
COLEGIO MIXTO EN TECNOLOGIA LATINOAMERICANO,COLEGIO MIXTO EN TECNOLOGÍA LATINOAMERICANO,97.67441860465115
"INSTITUTO PARTICULAR MIXTO""MARIA CHINCHILLA",INSTITUTO PARTICULAR MIXTO MARIA CHINCHILLA,97.67441860465115
"INSTITUTO PARTICULAR MIXTO""MARÍA CHINCHILLA","INSTITUTO PARTICULAR MIXTO""MARIA CHINCHILLA",97.67441860465115
"COLEGIO PARTICULAR MIXTO""SAN JOSE OBRERO II",COLEGIO PARTICULAR MIXTO SAN JOSE OBRERO II,97.67441860465115
INSTITUTO PRIVADO TÉCNICO INDUSTRIAL QUICHÉ,"INSTITUTO PRIVADO TÉCNICO INDUSTRIAL""QUICHÉ",97.67441860465115
