Nombre_Original,Nombre_Comparado,Similitud (%)
INSTITUTO PRIVADO NUESTRA SEÑORA DE AMÉRICA,INSTITUTO PRIVADO NUESTRA SEÑORA DE AMERICA,97.67441860465115
INSTITUTO TECNOLÓGICO DIGITALES COMERCIALES,INSTITUTO TECNOLOGICO DIGITALES COMERCIALES,97.67441860465115
"INSTITUTO PRIVADO MIXTO""JOSE ERNESTO MONZON",INSTITUTO PRIVADO MIXTO JOSE ERNESTO MONZON,97.67441860465115
INSTITUTO TECNOLOGICO PRIVADO DE COATEPEQUE,"INSTITUTO TECNOLOGICO PRIVADO DE""COATEPEQUE",97.67441860465115
LICEO CRISTIANO GUATEMALTECO NUEVO AMANECER,"LICEO CRISTIANO GUATEMALTECO""NUEVO AMANECER",97.67441860465115
INSTITUTO DIVERSIFICADO ADSC AL INEB DOCTOR WERNER OVALLE LÓPEZ,INSTITUTO DIVERSIFICADO ADSC. AL INEB DOCTOR WERNER OVALLE LOPEZ,97.63779527559055
LICEO TECNOLOGICO GUATEMALA DE LA ASUNCIÓN,LICEO TECNOLOGICO GUATEMALA DE LA ASUNCION,97.61904761904762
COLEGIO PRIVADO URBANO MIXTO LICEO MODERNO,"COLEGIO PRIVADO URBANO MIXTO""LICEO MODERNO",97.61904761904762
COLEGIO EXPERIMENTAL CRISTIANO VERBO NO. 2,COLEGIO EXPERIMENTAL CRISTIANO VERBO NO. 3,97.61904761904762
"CENTRO EDUCATIVO""CIENCIA Y TECNOLOGIA""CECT","CENTRO EDUCATIVO""CIENCIA Y TECNOLOGÍA""CECT",97.61904761904762
"INSTITUTO MIXTO PRIVADO""SALUD Y DESARROLLO",INSTITUTO MIXTO PRIVADO SALUD Y DESARROLLO,97.61904761904762
LICEO EN CIENCIA Y TECNOLOGIA DE OCCIDENTE,LICEO EN CIENCIA Y TECNOLOGÍA DE OCCIDENTE,97.61904761904762
COLEGIO PRIVADO MIXTO INNOVACION EDUCATIVA,"COLEGIO PRIVADO MIXTO""INNOVACION EDUCATIVA",97.61904761904762
COLEGIO EXPERIMENTAL CRISTIANO VERBO NO. 1,COLEGIO EXPERIMENTAL CRISTIANO VERBO NO. 4,97.61904761904762
COLEGIO MIXTO SAGRADA FAMILIA DE AMATITLÁN,COLEGIO MIXTO SAGRADA FAMILIA DE AMATITLAN,97.61904761904762
LICEO TECNOLOGICO GUATEMALA DE LA ASUNCIÓN,LICEO TECNOLÓGICO GUATEMALA DE LA ASUNCIÓN,97.61904761904762
COLEGIO EXPERIMENTAL CRISTIANO VERBO NO. 1,COLEGIO EXPERIMENTAL CRISTIANO VERBO NO. 2,97.61904761904762
COLEGIO PARTICULAR MIXTO SAN JOSÉ OBRERO I,COLEGIO PARTICULAR MIXTO SAN JOSE OBRERO I,97.61904761904762
COLEGIO PRIVADO MIXTO JACOBO ARBENZ GUZMAN,COLEGIO PRIVADO MIXTO JACOBO ARBENZ GUZMÁN,97.61904761904762
COLEGIO EXPERIMENTAL CRISTIANO VERBO NO. 1,COLEGIO EXPERIMENTAL CRISTIANO VERBO NO. 3,97.61904761904762
COLEGIO EXPERIMENTAL CRISTIANO VERBO NO. 2,COLEGIO EXPERIMENTAL CRISTIANO VERBO NO. 4,97.61904761904762
"COLEGIO PRIVADO MIXTO""JACOBO ARBENZ GUZMAN",COLEGIO PRIVADO MIXTO JACOBO ARBENZ GUZMAN,97.61904761904762
"COLEGIO MIXTO PRE UNIVERSITARIO""OSTUNCALCO",COLEGIO MIXTO PRE UNIVERSITARIO OSTUNCALCO,97.61904761904762
"COLEGIO DE CIENCIAS COMERCIALES""LAS CRUCES",COLEGIO DE CIENCIAS COMERCIALES LAS CRUCES,97.61904761904762
LICEO AMERICANO TECNOLOGICO DE COMPUTACIÓN,LICEO AMERICANO TECNOLÓGICO DE COMPUTACIÓN,97.61904761904762
COLEGIO EXPERIMENTAL CRISTIANO VERBO NO. 4,COLEGIO EXPERIMENTAL CRISTIANO VERBO NO. 3,97.61904761904762
COLEGIO EVANGELCO TECNOLOGICO PRIVADO MIXTO BERSHEBA BLESS GOD,COLEGIO EVANGÉLICO TECNOLOGICO PRIVADO MIXTO BERSHEBA BLESS GOD,97.6
COLEGIO EVANGÉLICO TECNOLOGICO PRIVADO MIXTO BERSHEBA BISS GOD,COLEGIO EVANGÉLICO TECNOLOGICO PRIVADO MIXTO BERSHEBA BLESS GOD,97.6
COLEGIO PRE UNIVERSITARIO AMERICA MODERNA,COLEGIO PRE UNIVERSITARIO AMÉRICA MODERNA,97.5609756097561
LICEO TECNICO PREUNIVERSITARIO TORRICELLI,LICEO TÉCNICO PREUNIVERSITARIO TORRICELLI,97.5609756097561
"COLEGIO MIXTO PRIVADO EL HORIZONTE""COMPEH",COLEGIO MIXTO PRIVADO EL HORIZONTE COMPEH,97.5609756097561
COLEGIO TECNICO PROFESIONAL SAN CRISTOBAL,"COLEGIO TECNICO PROFESIONAL""SAN CRISTOBAL",97.5609756097561
"INSTITUTO MIXTO DE EDUCACION""CONGUAQUENSE",INSTITUTO MIXTO DE EDUCACION CONGUAQUENSE,97.5609756097561
INSTITUTO MIXTO DE EDUCACION CONGUAQUENSE,INSTITUTO MIXTO DE EDUCACIÓN CONGUAQUENSE,97.5609756097561
"CENTRO EDUCATIVO CRISTIANO""FUENTE DE VIDA",CENTRO EDUCATIVO CRISTIANO FUENTE DE VIDA,97.5609756097561
"CENTRO EDUCATIVO TECNICO PORTILLO""CETPORT",CENTRO EDUCATIVO TECNICO PORTILLO CETPORT,97.5609756097561
"COLEGIO PROFESIONAL DE TURISMO""GUATEMALAM",COLEGIO PROFESIONAL DE TURISMO GUATEMALAM,97.5609756097561
COLEGIO MIXTO CRISTIANO NUEVOS HORIZONTES,"COLEGIO MIXTO CRISTIANO""NUEVOS HORIZONTES",97.5609756097561
COLEGIO DE INFORMÁTICA AVANZADA COMPUCEIC,"COLEGIO DE INFORMÁTICA AVANZADA""COMPUCEIC",97.5609756097561
INSTITUTO COMERCIAL DE CÓMPUTOS AVANZADOS,INSTITUTO COMERCIAL DE COMPUTOS AVANZADOS,97.5609756097561
"CENTRO EDUCATIVO TECNICO PORTILLO""CETPORT","CENTRO EDUCATIVO TÉCNICO PORTILLO""CETPORT",97.5609756097561
"COLEGIO EVANGÉLICO PRIVADO MIXTO""BETHESDA",COLEGIO EVANGÉLICO PRIVADO MIXTO BETHESDA,97.5609756097561
"COLEGIO PARTICULAR MIXTO""LICEO ESTANZUELA",COLEGIO PARTICULAR MIXTO LICEO ESTANZUELA,97.5609756097561
COLEGIO PARTICULAR MIXTO MATIAS DE GALVEZ,"COLEGIO PARTICULAR MIXTO""MATIAS DE GALVEZ",97.5609756097561
"INSTITUTO PREUNIVERSITARIO DE IZABAL""PREU",INSTITUTO PREUNIVERSITARIO DE IZABAL PREU,97.5609756097561
COLEGIO PRIVADO MIGUEL ÁNGEL SARAZÚA ROCA,"COLEGIO PRIVADO""MIGUEL ÁNGEL SARAZÚA ROCA",97.5609756097561
CENTRO EDUCACIONAL MIXTO PRIVADO KINGSTON,"CENTRO EDUCACIONAL MIXTO PRIVADO""KINGSTON",97.5609756097561
INSTITUTO PRIVADO MIXTO CIENCIA Y CULTURA,"INSTITUTO PRIVADO MIXTO""CIENCIA Y CULTURA",97.5609756097561
"COLEGIO EDUCATIVO PRIVADO MIXTO DE FORMACIÓN Y CAPACITACIÓN""MIGUEL ÁNGEL ASTURIAS",COLEGIO EDUCATIVO PRIVADO MIXTO DE FORMACIÓN Y CAPACITACIÓN MIGUEL ANGEL ASTURIAS,97.53086419753086
"COLEGIO""CENTRO DE FORMACIÓN PROFESIONAL PRE UNIVERSITARIA DEL CICLO DIVERSIFICADO",COLEGIO CENTRO DE FORMACIÓN PROFESIONAL PRE UNIVERISTARIA DEL CICLO DIVERSIFICADO,97.53086419753086
COLEGIO PARTICULAR MIXTO SAGRADO CORAZÓN,"COLEGIO PARTICULAR MIXTO""SAGRADO CORAZÓN",97.5
"INSTITUTO PARTICULAR MIXTO""LICEO GENESIS","INSTITUTO PARTICULAR MIXTO""LICEO GÉNESIS",97.5
COLEGIO PARTICULAR MIXTO SAGRADO CORAZÓN,COLEGIO PARTICULAR MIXTO SAGRADO CORAZON,97.5
COLEGIO CIENTÍFICO INTEGRAL RENACIMIENTO,COLEGIO CIENTIFICO INTEGRAL RENACIMIENTO,97.5
"COLEGIO TECNICO PRIVADO MIXTO""LUZ Y VIDA","COLEGIO TÉCNICO PRIVADO MIXTO""LUZ Y VIDA",97.5
COLEGIO PRIVADO ENRIQUE NOVELLA ALVARADO,"COLEGIO PRIVADO""ENRIQUE NOVELLA ALVARADO",97.5
"CENTRO EDUCATIVO TECNOLÓGICO""EL NAZARENO",CENTRO EDUCATIVO TECNOLÓGICO EL NAZARENO,97.5
COLEGIO PRIVADO MIXTO ESTRELLA DEL ÉXITO,"COLEGIO PRIVADO MIXTO""ESTRELLA DEL ÉXITO",97.5
INSTITUTO TECNOLOGICO PRIVADO DE ORIENTE,INSTITUTO TECNOLÓGICO PRIVADO DE ORIENTE,97.5
"LICEO PRIVADO POCHUTECO""CAMINO AL FUTURO",LICEO PRIVADO POCHUTECO CAMINO AL FUTURO,97.5
"INSTITUTO PRIVADO MIXTO""EL MAESTRO AMIGO",INSTITUTO PRIVADO MIXTO EL MAESTRO AMIGO,97.5
COLEGIO HISPANO AMÉRICANO HACIENDA VERDE,COLEGIO HISPANO AMERICANO HACIENDA VERDE,97.5
INSTITUTO DE EDUCACIÓN MEDIA POR MADUREZ,INSTITUTO DE EDUCACION MEDIA POR MADUREZ,97.5
INSTITUTO PARTICULAR MIXTO DE EDUCACION BÁSICA Y DIVERSIFICADA DR. PEDRO MOLINA,"INSTITUTO PARTICULAR MIXTO DE EDUCACION BASICA Y DIVERSIFICADA""DR. PEDRO MOLINA",97.46835443037975
"INSTITUTO PARTICULAR MIXTO DE EDUCACIÓN BÁSICA Y DIVERSIFICADA""DR. PEDRO MOLINA","INSTITUTO PARTICULAR MIXTO DE EDUCACION BASICA Y DIVERSIFICADA""DR. PEDRO MOLINA",97.46835443037975
"INSTITUTO PARTICULAR MIXTO DE EDUCACION BÁSICA Y DIVERSIFICADA""DR. PEDRO MOLINA",INSTITUTO PARTICULAR MIXTO DE EDUCACION BASICA Y DIVERSIFICADA DR. PEDRO MOLINA,97.46835443037975
INSTITUTO PARTICULAR MIXTO DE EDUCACION BÁSICA Y DIVERSIFICADA DR. PEDRO MOLINA,"INSTITUTO PARTICULAR MIXTO DE EDUCACIÓN BÁSICA Y DIVERSIFICADA""DR. PEDRO MOLINA",97.46835443037975
CENTRO DE DESARROLLO EDUCATIVO SAN JOSE,"CENTRO DE DESARROLLO EDUCATIVO""SAN JOSE",97.43589743589743
"LICEO MIXTO BILINGÜE""PEDAGOGICO MODERNO",LICEO MIXTO BILINGÜE PEDAGOGICO MODERNO,97.43589743589743
COLEGIO TÉCNICO PRIVADO MIXTO LA PATRIA,COLEGIO TECNICO PRIVADO MIXTO LA PATRIA,97.43589743589743
COLEGIO PARTICULAR MIXTO NUEVO AMANECER,"COLEGIO PARTICULAR MIXTO""NUEVO AMANECER",97.43589743589743
INSTITUTO TECNOLOGICO DOCTOR THEO BLOEM,INSTITUTO TECNOLÓGICO DOCTOR THEO BLOEM,97.43589743589743
"COLEGIO PRIVADO BILINGÜE""FUENTE DE VIDA",COLEGIO PRIVADO BILINGÜE FUENTE DE VIDA,97.43589743589743
INSTITUTO NACIONAL DE FORMACIÓN TÉCNICA,INSTITUTO NACIONAL DE FORMACIÓN TECNICA,97.43589743589743
"LICEO EVANGÉLICO""PRADOS DE VILLAHERMOSA",LICEO EVANGÉLICO PRADOS DE VILLAHERMOSA,97.43589743589743
ESCUELA PRIVADA NORMAL MAYA LA ASUNCIÓN,ESCUELA PRIVADA NORMAL MAYA LA ASUNCION,97.43589743589743
"COLEGIO PARTICULAR MIXTO""LICEO PROGRESO",COLEGIO PARTICULAR MIXTO LICEO PROGRESO,97.43589743589743
COLEGIO INTEGRAL HUMANISTICO CHIANTLECO,COLEGIO INTEGRAL HUMANÍSTICO CHIANTLECO,97.43589743589743
INSTITUTO TECNICO INDUSTRIAL HENRY FORD,INSTITUTO TÉCNICO INDUSTRIAL HENRY FORD,97.43589743589743
"INSTITUTO TÉCNICO INDUSTRIAL""HENRY FORD",INSTITUTO TÉCNICO INDUSTRIAL HENRY FORD,97.43589743589743
"INSTITUTO TECNICO INDUSTRIAL""HENRY FORD",INSTITUTO TECNICO INDUSTRIAL HENRY FORD,97.43589743589743
"INSTITUTO TECNICO INDUSTRIAL""HENRY FORD","INSTITUTO TÉCNICO INDUSTRIAL""HENRY FORD",97.43589743589743
"INSTITUTO NACIONAL""JACOBO ARBENZ GUZMÁN",INSTITUTO NACIONAL JACOBO ARBENZ GUZMÁN,97.43589743589743
"COLEGIO PRIVADO MIXTO""LICEO SANTA MARIA",COLEGIO PRIVADO MIXTO LICEO SANTA MARIA,97.43589743589743
"COLEGIO INTEGRAL DE COMPUTACIÓN""EDUCARE",COLEGIO INTEGRAL DE COMPUTACIÓN EDUCARE,97.43589743589743
"COLEGIO PARTICULAR MIXTO""PIEDRAS NEGRAS",COLEGIO PARTICULAR MIXTO PIEDRAS NEGRAS,97.43589743589743
INSTITUTO TECNICO DE CAPACITACIÓN Y PRODUCTIVIDAD INTECAP,"INSTITUTO TECNICO DE CAPACITACION Y PRODUCTIVIDAD, INTECAP",97.3913043478261
"COLEGIO PRIVADO MIXTO""PERPETUO SOCORRO",COLEGIO PRIVADO MIXTO PERPETUO SOCORRO,97.36842105263158
"CENTRO EDUCATIVO MIXTO""LICEO DEL VALLE",CENTRO EDUCATIVO MIXTO LICEO DEL VALLE,97.36842105263158
INSTITUTO MUNICIPAL DE EDUCACIÓN MEDIA,INSTITUTO MUNICIPAL DE EDUCACION MEDIA,97.36842105263158
TECNOLÓGICO MODERNO CENTRO EDUCACIONAL,TECNOLOGICO MODERNO CENTRO EDUCACIONAL,97.36842105263158
TECNOLOGICO MODERNO CENTRO EDUCACIONAL,"TECNOLOGICO MODERNO""CENTRO EDUCACIONAL",97.36842105263158
LICEO POLITECNICO PEDAGOGICO ANTIGUEÑO,LICEO POLITECNICO PEDAGOGICO ANTIGÜEÑO,97.36842105263158
"COLEGIO PARTICULAR MIXTO""SAN FRANCISCO",COLEGIO PARTICULAR MIXTO SAN FRANCISCO,97.36842105263158
CENTRO EDUCATIVO INMACULADA CONCEPCION,CENTRO EDUCATIVO INMACULADA CONCEPCIÓN,97.36842105263158
"COLEGIO PRIVADO MIXTO""NUEVA GENERACIÓN",COLEGIO PRIVADO MIXTO NUEVA GENERACIÓN,97.36842105263158
"COLEGIO PRIVADO MIXTO""SANTIAGO APOSTOL","COLEGIO PRIVADO MIXTO""SANTIAGO APÓSTOL",97.36842105263158
LICEO TÉCNICO COMERCIAL EN COMPUTACIÓN,LICEO TECNICO COMERCIAL EN COMPUTACIÓN,97.36842105263158
INSTITUTO NACIONAL NITO PALENCIA MAYEN,INSTITUTO NACIONAL NITO PALENCIA MAYÉN,97.36842105263158
ACADEMIA COMERCIAL E INSTITUTO LOURDES,"ACADEMIA COMERCIAL E INSTITUTO""LOURDES",97.36842105263158
"COLEGIO EVANGÉLICO METODISTA""MARANATHA",COLEGIO EVANGÉLICO METODISTA MARANATHA,97.36842105263158
"COLEGIO PRIVADO MIXTO""NUEVO HORIZONTE","COLEGIO PRIVADO MIXTO""NUEVOS HORIZONTES",97.36842105263158
"LICEO DE CIENCIAS TÉCNICAS""EL REDENTOR",LICEO DE CIENCIAS TÉCNICAS EL REDENTOR,97.36842105263158
CENTRO EDUCATIVO FORMADORES DE LÍDERES,CENTRO EDUCATIVO FORMADORES DE LIDERES,97.36842105263158
COLEGIO PARTICULAR MIXTO CENTRO INTREGRAL SISTEMÁTICO CIS,"COLEGIO PARTICULAR MIXTO""CENTRO INTEGRAL SISTEMÁTICO CIS",97.34513274336283
CENTRO EDUCATIVO DE INFORMÁTICA SINAÍ,CENTRO EDUCATIVO DE INFORMÁTICA SINAI,97.2972972972973
"COLEGIO PRIVADO MIXTO""RAFAEL LANDIVAR",COLEGIO PRIVADO MIXTO RAFAEL LANDIVAR,97.2972972972973
CENTRO CULTURAL SAGRADA FAMILIA NO. 2,CENTRO CULTURAL SAGRADA FAMILIA NO. 1,97.2972972972973
LICEO PRIVADO DE CIENCIAS COMERCIALES,LICEO PRIVADO DE CIENCIAS COMERICALES,97.2972972972973
INSTITUTO TECNOLÓGICO POR COOPERATIVA,INSTITUTO TECNOLOGICO POR COOPERATIVA,97.2972972972973
COLEGIO PARTICULAR MIXTO LICEO JALAPA,"COLEGIO PARTICULAR MIXTO""LICEO JALAPA",97.2972972972973
INSTITUTO TÉCNICO PARTICULAR DE DIVERSIFICADO INTECPADI,"INSTITUTO TECNICO PARTICULAR DE DIVERSIFICADO, INTECPADI",97.2972972972973
"COLEGIO INTEGRAL""CIENCIA Y DESARROLLO",COLEGIO INTEGRAL CIENCIA Y DESARROLLO,97.2972972972973
"COLEGIO PRIVADO""SAN FRANCISCO DE ASÍS","COLEGIO PRIVADO""SAN FRANCISCO DE ASIS",97.2972972972973
CENTRO EDUCATIVO TECNOLÓGICO EMILIANO,CENTRO EDUCATIVO TECNOLOGICO EMILIANO,97.2972972972973
COLEGIO EN COMPUTACIÓN SAN JOSÉ NO. 1,COLEGIO EN COMPUTACIÓN SAN JOSÉ NO. 2,97.2972972972973
COLEGIO EN COMPUTACIÓN SAN JOSE NO. 2,COLEGIO EN COMPUTACIÓN SAN JOSÉ NO. 2,97.2972972972973
"COLEGIO EVANGÉLICO MIXTO""PALABRA VIVA",COLEGIO EVANGÉLICO MIXTO PALABRA VIVA,97.2972972972973
COLEGIO PARTICULAR MIXTO SAN JERONIMO,COLEGIO PARTICULAR MIXTO SAN JERÓNIMO,97.2972972972973
"COLEGIO DE EDUCACION MEDIA""SAN ISIDRO",COLEGIO DE EDUCACION MEDIA SAN ISIDRO,97.2972972972973
COLEGIO DE EDUCACIÓN MEDIA SAN ISIDRO,COLEGIO DE EDUCACION MEDIA SAN ISIDRO,97.2972972972973
CENTRO DE EDUCACIÓN EXTRAESCOLAR CEEX,CENTRO DE EDUCACION EXTRAESCOLAR CEEX,97.2972972972973
"COLEGIO PRIVADO MIXTO""LICEO LORENZANO",COLEGIO PRIVADO MIXTO LICEO LORENZANO,97.2972972972973
"INSTITUTO PRIVADO DE EDUCACION DE CIENCIAS Y TECNOLOGIA""LA SAGRADA FAMILIA","INSTITUTO PRIVADO DE EDUCACIÓN DE CIENCIAS Y TECNOLOGÍA""LA SAGRADA FAMILIA",97.2972972972973
INSTITUTO NACIONAL PC. BRENDA ELIZABETH DEL CID MEDRANO,"INSTITUTO NACIONAL""PC BRENDA ELIZABETH DEL CID MEDRANO",97.24770642201834
"CENTRO EDUCATIVO PRIVADO""MONTE HOREB",CENTRO EDUCATIVO PRIVADO MONTE HOREB,97.22222222222221
"COLEGIO PRIVADO MIXTO""EL BUEN PASTOR",COLEGIO PRIVADO MIXTO EL BUEN PASTOR,97.22222222222221
COLEGIO TECNOLOGICO MODERNO VYGOTSKI,COLEGIO TECNOLÓGICO MODERNO VYGOTSKI,97.22222222222221
CENTRO DE EDUCACION CREATIVA TOSCANA,CENTRO DE EDUCACIÓN CREATIVA TOSCANA,97.22222222222221
"COLEGIO PARTICULAR MIXTO""SANTA MARIA","COLEGIO PARTICULAR MIXTO""SANTA MARÍA",97.22222222222221
COLEGIO TECNICO DE COMPUTACIÓN C.T.S,COLEGIO TÉCNICO DE COMPUTACIÓN C.T.S,97.22222222222221
COLEGIO PRIVADO MIXTO LICEO MAZATECO,"COLEGIO PRIVADO MIXTO""LICEO MAZATECO",97.22222222222221
CENTRO EDUCATIVO FORMACIÓN Y CIENCIA,"CENTRO EDUCATIVO""FORMACIÓN Y CIENCIA",97.22222222222221
COLEGIO PRIVADO MIXTO LICEO SAN LUIS,"COLEGIO PRIVADO MIXTO""LICEO SAN LUIS",97.22222222222221
INSTITUTO PARTICULAR MIXTO EL JÍCARO,INSTITUTO PARTICULAR MIXTO EL JICARO,97.22222222222221
COLEGIO PRIVADO MIXTO NUEVO AMANECER,"COLEGIO PRIVADO MIXTO""NUEVO AMANECER",97.22222222222221
COLEGIO PRIVADO MIXTO LICEO CUYOTECO,"COLEGIO PRIVADO MIXTO""LICEO CUYOTECO",97.22222222222221
INSTITUTO PRIVADO TECNOLOGICO BENSON,INSTITUTO PRIVADO TECNOLÓGICO BENSON,97.22222222222221
LICEO COMERCIAL TECNOLOGICO EL RODEO,LICEO COMERCIAL TECNOLÓGICO EL RODEO,97.22222222222221
INSTITUTO DE EDUCACIÓN DIVERSIFICADA,INSTITUTO DE EDUCACION DIVERSIFICADA,97.22222222222221
CENTRO EDUCATIVO FE Y ALEGRIA NO. 14,CENTRO EDUCATIVO FE Y ALEGRIA NO. 49,97.22222222222221
CENTRO EDUCATIVO FE Y ALEGRÍA NO. 48,CENTRO EDUCATIVO FE Y ALEGRÍA NO. 44,97.22222222222221
INSTITUTO DIVERSIFICADO POR COOPERATIVA DE ENSEÑANZA,INSTITUTO DE DIVERSIFICADO POR COOPERATIVA DE ENSEÑANZA,97.19626168224299
"LICEO FORMACIÓN BASICA Y PROFESIONAL""LATINOAMERICANO","LICEO DE FORMACIÓN BASICA Y PROFESIONAL""LATINOAMERICANO",97.19626168224299
COLEGIO DE INFORMÁTICA IMB PC NO. 1,COLEGIO DE INFORMÁTICA IMB PC NO. 2,97.14285714285714
INSTITUTO TECNOLOGICO DE SURORIENTE,INTITUTO TECNOLOGICO DE SUR ORIENTE,97.14285714285714
INSTITUTO TECNOLOGICO DE SURORIENTE,INSTITUTO TECNOLÓGICO DE SURORIENTE,97.14285714285714
"ESCUELA NORMAL PARA MAESTROS DE EDUCACIÒN MUSICAL""JESÚS MARÍA ALVARADO",ESCUELA NORMAL PARA MAESTROS DE EDUCACIÓN MUSICAL JESÚS MARÍA ALVARADO,97.14285714285714
"COLEGIO MIXTO EN COMPUTACIÓN""IMANOL",COLEGIO MIXTO EN COMPUTACIÓN IMANOL,97.14285714285714
INSTITUTO TÉCNICO EMILIANI SOMASCOS,INSTITUTO TECNICO EMILIANI SOMASCOS,97.14285714285714
INSTITUTO PRIVADO MIXTO SAN LORENZO,"INSTITUTO PRIVADO MIXTO""SAN LORENZO",97.14285714285714
"COLEGIO PRIVADO MIXTO""SANTA BARBARA",COLEGIO PRIVADO MIXTO SANTA BARBARA,97.14285714285714
"CENTRO EDUCATIVO""RUNAWAL B´ALAM YA´","CENTRO EDUCATIVO""RUNAWAL B´ALAM YA¨",97.14285714285714
"INSTITUTO MIXTO""MIGUEL DE CERVANTES",INSTITUTO MIXTO MIGUEL DE CERVANTES,97.14285714285714
COLEGIO CRISTIANO JESÚS DE NAZARETH,COLEGIO CRISTIANO JESUS DE NAZARETH,97.14285714285714
COLEGIO PRIVADO MIXTO LICEO MODERNO,"COLEGIO PRIVADO MIXTO""LICEO MODERNO",97.14285714285714
LICEO PREUNIVERSITARIO PANAMERICANO,"LICEO PREUNIVERSITARIO""PANAMERICANO",97.14285714285714
"ESCUELA NORMAL PARA MAESTROS DE EDUCACIÒN MUSICAL""JESÚS MARÍA ALVARADO","ESCUELA NORMAL PARA MAESTROS DE EDUCACIÓN MUSICAL""JESUS MARÍA ALVARADO",97.14285714285714
ESCUELA NORMAL PARA MAESTROS DE EDUCACIÓN MUSICAL JESÚS MARÍA ALVARADO,"ESCUELA NORMAL PARA MAESTROS DE EDUCACIÓN MUSICAL""JESUS MARÍA ALVARADO",97.14285714285714
CENTRO EDUCATIVO FE Y ALEGRÍA NO. 7,CENTRO EDUCATIVO FE Y ALEGRÍA NO. 6,97.14285714285714
LICEO TECNICO INDUSTRIAL MAYA TIKAL,LICEO TÉCNICO INDUSTRIAL MAYA TIKAL,97.14285714285714
CENTRO EDUCATIVO FE Y ALEGRÍA NO. 7,CENTRO EDUCATIVO FE Y ALEGRÍA NO. 2,97.14285714285714
COLEGIO MIXTO CIENCIAS TECNOLÓGICAS,COLEGIO MIXTO CIENCIAS TECNOLOGICAS,97.14285714285714
INSTITUTO EVANGÉLICO AMÉRICA LATINA,"INSTITUTO EVANGÉLICO""AMÉRICA LATINA",97.14285714285714
INSTITUTO EVANGÉLICO AMÉRICA LATINA,INSTITUTO EVANGÉLICO AMERICA LATINA,97.14285714285714
CENTRO EDUCATIVO FE Y ALEGRÍA NO. 6,CENTRO EDUCATIVO FE Y ALEGRÍA NO. 2,97.14285714285714
"COLEGIO CRISTIANO BILINGÜE""BLUE SKY",COLEGIO CRISTIANO BILINGÜE BLUE SKY,97.14285714285714
COLEGIO PRIVADO MIXTO HERMANO PEDRO,"COLEGIO PRIVADO MIXTO""HERMANO PEDRO",97.14285714285714
"COLEGIO PRIVADO MIXTO""SAN SEBASTIÁN",COLEGIO PRIVADO MIXTO SAN SEBASTIÁN,97.14285714285714
COLEGIO EDUCATIVO DE DESARROLLO INFORMÁTICO Y CIENTÍFICO DE AMATITLÁN,COLEGIO EDUCATIVO DE DESARROLLO INFORMATICO Y CIENTIFICO DE AMATITLÁN,97.10144927536231
"COLEGIO MIXTO EVANGÉLICO""BETHLEHEM","COLEGIO MIXTO EVANGÈLICO""BETHLEHEM",97.05882352941177
LICEO CIENTÍFICO SAN JUAN BAUTISTA,LICEO CIENTIFICO SAN JUAN BAUTISTA,97.05882352941177
"COLEGIO PRIVADO MIXTO""ISAAC NEWTON",COLEGIO PRIVADO MIXTO ISAAC NEWTON,97.05882352941177
"CENTRO EDUCATIVO INTEGRAL""EL SABER",CENTRO EDUCATIVO INTEGRAL EL SABER,97.05882352941177
"COLEGIO EVANGÉLICO""NUEVA JERUSALEN",COLEGIO EVANGÉLICO NUEVA JERUSALEN,97.05882352941177
"INSTITUTO PRIVADO MIXTO""CONCEPCION","INSTITUTO PRIVADO MIXTO""CONCEPCIÓN",97.05882352941177
"INSTITUTO PRIVADO MIXTO""MALACATECO",INSTITUTO PRIVADO MIXTO MALACATECO,97.05882352941177
CENTRO TECNOLOGICO INDUSTRIAL CETI,"CENTRO TECNOLOGICO INDUSTRIAL""CETI",97.05882352941177
"COLEGIO MIXTO""JUSTO RUFINO BARRIOS",COLEGIO MIXTO JUSTO RUFINO BARRIOS,97.05882352941177
COLEGIO TECNOLOGICO CABALLO BLANCO,COLEGIO TECNOLÓGICO CABALLO BLANCO,97.05882352941177
CENTRO EDUCATIVO MIXTO LOS ROSALES,"CENTRO EDUCATIVO MIXTO""LOS ROSALES",97.05882352941177
COLEGIO TECNOLÓGICO CABALLO BLANCO,"COLEGIO TECNOLÓGICO""CABALLO BLANCO",97.05882352941177
"COLEGIO EVANGÉLICO MIXTO""GETSEMANI",COLEGIO EVANGÉLICO MIXTO GETSEMANI,97.05882352941177
"COLEGIO EVANGÉLICO MIXTO""GETSEMANI","COLEGIO EVANGÉLICO MIXTO""GETSEMANÍ",97.05882352941177
"COLEGIO DEL NIVEL MEDIO""SUPERACION","COLEGIO DEL NIVEL MEDIO""SUPERACIÓN",97.05882352941177
COLEGIO TECNOLÓGICO DE INFORMÁTICA,COLEGIO TECNOLOGICO DE INFORMÁTICA,97.05882352941177
"CENTRO TECNOLOGICO INDUSTRIAL""CETI","CENTRO TECNOLÓGICO INDUSTRIAL""CETI",97.05882352941177
"COLEGIO PARTICULAR MIXTO""EBEN EZER",COLEGIO PARTICULAR MIXTO EBEN EZER,97.05882352941177
COLEGIO PREUNIVERSITARIO SALAMANCA,"COLEGIO PREUNIVERSITARIO""SALAMANCA",97.05882352941177
"COLEGIO TECNOLOGICO""PIEDRA PARTIDA","COLEGIO TECNOLÓGICO""PIEDRA PARTIDA",97.05882352941177
INSTITUTO NACIONAL DE EDUCACION DIVERSIFICADA INED,"INSTITUTO NACIONAL DE EDUCACIÓN DIVERSIFICADA, INED",97.02970297029702
INSTITUTO NACIONAL DE EDUCACION DIVERSIFICADO INED,"INSTITUTO NACIONAL DE EDUCACION DIVERSIFICADA, INED",97.02970297029702
"PROGRAMA NACIONAL DE EDUCACION ALTERNATIVA, PRONEA","PROGRAMA NACIONAL DE EDUCACIÓN ALTERNATIVA , PRONEA",97.02970297029702
CENTRO DE ESTUDIOS PREUNIVERSITARIOS CAHABON CEPREC,CENTRO DE ESTUDIOS PREUNIVERSITARIO CAHABÓN CEPREC,97.02970297029702
INSTITUTO NACIONAL DE EDUCACIÓN DIVERSIFICADA INED,"INSTITUTO NACIONAL DE EDUCACION DIVERSIFICADA, INED",97.02970297029702
"ESCUELA EXPERIMENTAL CON ORIENTACIÓN OCUPACIONAL""VILLA DE LOS NIÑOS",ESCUELA EXPERIMENTAL CON ORIENTACION OCUPACIONAL VILLA DE LOS NIÑOS,97.01492537313433
INSTITUTO MUNICIPAL DE EDUCACION BASICA POR MADUREZ Y DIVERSIFICADO,INSTITUTO MUNICIPAL DE EDUCACIÓN BÁSICA POR MADUREZ Y DIVERSIFICADO,97.01492537313433
COLEGIO PARTICULAR MIXTO EL EXITO,COLEGIO PARTICULAR MIXTO EL ÉXITO,96.96969696969697
INSTITUTO MUNICIPAL DE EDUCACIÓN BÁSICA Y BACHILLERATO POR MADUREZ,INSTITUTO MUNICIPAL DE EDUCACION BASICA Y BACHILLERATO POR MADUREZ,96.96969696969697
COLEGIO COSTASUR,COLEGIO COSTA SUR,96.96969696969697
PROGRAMA NACIONAL DE EDUCACIÓN ALTERNATIVA PRONEA,"PROGRAMA NACIONAL DE EDUCACION ALTERNATIVA, PRONEA",96.96969696969697
COLEGIO INTEGRAL NUEVA GENERACIÓN,COLEGIO INTEGRAL NUEVA GENERACION,96.96969696969697
"COLEGIO PARTICULAR MIXTO""EL EXITO",COLEGIO PARTICULAR MIXTO EL EXITO,96.96969696969697
INSTITUTO TECNOLOGICO EMPRESARIAL,INSTITUTO TECNOLÓGICO EMPRESARIAL,96.96969696969697
"CENTRO EDUCATIVO INTEGRAL""FAGIOLI",CENTRO EDUCATIVO INTEGRAL FAGIOLI,96.96969696969697
CENTRO DE ESTUDIOS INTEGRADOS CEI,"CENTRO DE ESTUDIOS INTEGRADOS""CEI",96.96969696969697
INSTITUTO MIXTO NOCTURNO EL ANGEL,"INSTITUTO MIXTO NOCTURNO""EL ANGEL",96.96969696969697
"COLEGIO EVANGÉLICO MIXTO""PLENITUD",COLEGIO EVANGÉLICO MIXTO PLENITUD,96.96969696969697
"PROGRAMA NACIONAL DE EDUCACIÓN ALTERNATIVA, PRONEA",PROGRAMA NACIONAL DE EDUCACION ALTERNATIVA PRONEA,96.96969696969697
"COLEGIO TECNOLÓGICO""BLAISE PASCAL",COLEGIO TECNOLÓGICO BLAISE PASCAL,96.96969696969697
"PROGRAMA NACIONAL DE EDUCACIÓN ALTERNATIVA , PRONEA",PROGRAMA NACIONA DE EDUCACIÓN ALTERNATIVA PRONEA,96.96969696969697
COLEGIO TECNOLOGICO BLAISE PASCAL,COLEGIO TECNOLÓGICO BLAISE PASCAL,96.96969696969697
"CENTRO DE EDUCACIÓN EXTRAESCOLAR, MUNICIPAL, CEEX",CENTRO DE EDUCACIÓN EXTRAESCOLAR MUNICIPAL CEEXM,96.90721649484536
PROGRAMA NACIONAL DE EDUCACION ALTERNATIVA PRONEA,PROGRAMA NACIONA DE EDUCACIÓN ALTERNATIVA PRONEA,96.90721649484536
"CENTRO EDUCATIVO IMB PC EN LINEA, (IMB PC ONLINE)",CENTRO EDUCATIVO IMB PC EN LÍNEA (IMB PC ONLINE),96.90721649484536
"COLEGIO""CENTRO DE FORMACIÓN PROFESIONAL PREUNIVERSITARIA DEL CICLO DIVERSIFICADO",COLEGIO CENTRO DE FORMACIÓN PROFESIONAL PRE UNIVERISTARIA DEL CICLO DIVERSIFICADO,96.8944099378882
LICEO TECNICO GUATEMALTECO IDETI,LICEO TÉCNICO GUATEMALTECO IDETI,96.875
INSTITUTO MUNICIPAL DE EDUCACION,INSTITUTO MUNICIPAL DE EDUCACIÓN,96.875
INSTITUTO TECNOLÓGICO SANARATECO,INSTITUTO TECNOLOGICO SANARATECO,96.875
"COLEGIO PRIVADO MIXTO""SUPERACION",COLEGIO PRIVADO MIXTO SUPERACION,96.875
"COLEGIO PARTICULAR MIXTO""GENESIS",COLEGIO PARTICULAR MIXTO GENESIS,96.875
INSTITUTO PRIVADO MIXTO ESFUERZO,"INSTITUTO PRIVADO MIXTO""ESFUERZO",96.875
"COLEGIO PRIVADO MIXTO""EL PARAÍSO",COLEGIO PRIVADO MIXTO EL PARAÍSO,96.875
"COLEGIO PARTICULAR MIXTO""ROSALES",COLEGIO PARTICULAR MIXTO ROSALES,96.875
LICEO TECNICO VOCACIONAL GALILEI,LICEO TÉCNICO VOCACIONAL GALILEI,96.875
"COLEGIO MIXTO BILINGÜE""QUETZALLI",COLEGIO MIXTO BILINGÜE QUETZALLI,96.875
"COLEGIO EVANGÉLICO MIXTO""NAZARET",COLEGIO EVANGÉLICO MIXTO NAZARET,96.875
"COLEGIO PARTICULAR MIXTO""MINERVA",COLEGIO PARTICULAR MIXTO MINERVA,96.875
INSTITUTO TÉCNICO DE NIVEL MEDIO,INSTITUTO TECNICO DE NIVEL MEDIO,96.875
"COLEGIO PRIVADO MIXTO""EL PARAISO","COLEGIO PRIVADO MIXTO""EL PARAÍSO",96.875
INSTITUTO PRIVADO MIXTO SAN JUAN,"INSTITUTO PRIVADO MIXTO""SAN JUAN",96.875
COLEGIO PARTICULAR MIXTO GÉNESIS,COLEGIO PARTICULAR MIXTO GENESIS,96.875
"COLEGIO PRIVADO MIXTO""SUPERACIÓN","COLEGIO PRIVADO MIXTO""SUPERACION",96.875
"COLEGIO BILINGÜE DE COMPUTACIÓN C.B.C.""EL CARMEN",COLEGIO BILINGÜE DE COMPUTACIÓN C.B.C EL CARMEN,96.84210526315789
"INSTITUTO TECNOLOGICO VOCACIONAL""MARCO TULIO DE LA CRUZ MORALES",INSTITUTO TECNOLÓGICO VOCACIONAL MARCO TULIO DE LA CRUZ MORALES,96.82539682539682
INSTITUTO TECNOLOGICO VOCACIONAL MARCO TULIO DE LA CRUZ MORALES,"INSTITUTO TECNOLÓGICO VOCACIONAL""MARCO TULIO DE LA CRUZ MORALES",96.82539682539682
"COLEGIO MIXTO BILINGÜE""BROOKLYN",COLEGIO MIXTO BILINGÜE BROOKLYN,96.7741935483871
COLEGIO INTELIGENCIAS MULTIPLES,COLEGIO INTELIGENCIAS MÚLTIPLES,96.7741935483871
"COLEGIO DE INFORMÁTICA""CENINFAV",COLEGIO DE INFORMÁTICA CENINFAV,96.7741935483871
"COLEGIO MIXTO BILINGÜE""SANTA FE",COLEGIO MIXTO BILINGÜE SANTA FE,96.7741935483871
COLEGIO PRIVADO LIC. DAVID VELA,"COLEGIO PRIVADO""LIC. DAVID VELA",96.7741935483871
COLEGIO RAFAEL AREVALO MARTINEZ,COLEGIO RAFAEL AREVALO MARTÍNEZ,96.7741935483871
COLEGIO PRIVADO MIXTO AMERICANO,"COLEGIO PRIVADO MIXTO""AMERICANO",96.7741935483871
"LICEO TECNOLOGICO""JOSE DE JESUS",LICEO TECNOLOGICO JOSE DE JESUS,96.7741935483871
"COLEGIO PRIVADO""AMERICA DIGITAL","COLEGIO PRIVADO""AMÉRICA DIGITAL",96.7741935483871
COLEGIO PRIVADO DE EDUCACIÓN BÁSICA Y DIVERSIFICADA JUAN DIEGO,COLEGIO PRIVADO DE EDUCACION BASICA Y DIVERSIFICADA JUAN DIEGO,96.7741935483871
CENTRO EDUCACIONAL DE CIENCIAS CONTABLES CECON,CENTRO EDUCACINAL DE CIENCIAS CONTABLES. CECCON,96.7741935483871
"COLEGIO CRISTIANO""EL HASHAMAYIM",COLEGIO CRISTIANO EL HASHAMAYIM,96.7741935483871
COLEGIO PRIVADO MIXTO BENDICION,COLEGIO PRIVADO MIXTO BENDICIÓN,96.7741935483871
"COLEGIO PARTICULAR MIXTO""NIHAIB",COLEGIO PARTICULAR MIXTO NIHAIB,96.7741935483871
COLEGIO MIXTO SAN JUAN BAUTISTA,"COLEGIO MIXTO""SAN JUAN BAUTISTA",96.7741935483871
"LICEO COMERCIAL""NUEVA ENSEÑANZA",LICEO COMERCIAL NUEVA ENSEÑANZA,96.7741935483871
