Nombre_Original,Nombre_Comparado,Similitud (%)
"INSTITUTO TECNOLÓGICO PRIVADO URBANO MIXTO""FERDINAND LASSALLE",INSTITUTO TECNOLOGICO PRIVADO URBANO MIXTO FERDINAND LASSALLE,96.72131147540983
COLEGIO EVANGÉLICO MIXTO SINAI,COLEGIO EVANGÉLICO MIXTO SINAÍ,96.66666666666667
"CENTRO EDUCATIVO""NUESTRO MUNDO",CENTRO EDUCATIVO NUESTRO MUNDO,96.66666666666667
"LICEO EDUCATIVO""ARTE Y CULTURA",LICEO EDUCATIVO ARTE Y CULTURA,96.66666666666667
COLEGIO PRIVADO MIXTO SAN JUAN,"COLEGIO PRIVADO MIXTO""SAN JUAN",96.66666666666667
CENTRO EDUCATIVO APOYATE EN MÍ,CENTRO EDUCATIVO APÓYATE EN MÍ,96.66666666666667
COLEGIO EVANGÉLICO MIXTO BEREA,"COLEGIO EVANGÉLICO MIXTO""BEREA",96.66666666666667
"COLEGIO PRIVADO MIXTO""SAN JOSE","COLEGIO PRIVADO MIXTO""SAN JOSÉ",96.66666666666667
"CENTRO EDUCATIVO""MANUEL GALICH",CENTRO EDUCATIVO MANUEL GALICH,96.66666666666667
"COLEGIO EVANGÉLICO MIXTO""SINAÍ",COLEGIO EVANGÉLICO MIXTO SINAÍ,96.66666666666667
COLEGIO LATINOAMERICANO GOSPEL,"COLEGIO LATINOAMERICANO""GOSPEL",96.66666666666667
CENTRO EDUCATIVO JUAN PABLO II,"CENTRO EDUCATIVO""JUAN PABLO II",96.66666666666667
INSTITUTO TECNOLOGIA Y CIENCIA,INSTITUTO TECNOLOGÍA Y CIENCIA,96.66666666666667
"CENTRO EDUCATIVO""APÓYATE EN MÍ",CENTRO EDUCATIVO APÓYATE EN MÍ,96.66666666666667
INSTITUTO TECNOLÓGICO DIGITALES COMERCIALES II,INSTITUTO TECNOLÓGICO DIGITALES COMERCIALES,96.62921348314607
INSTITUTO TECNICO INDUSTRIAL DE CHIQUIMULILLA,INSITUTO TÉCNICO INDUSTRIAL DE CHIQUIMULILLA,96.62921348314607
INSTITUTO TECNOLOGICO DIGITALES COMERCIALES,INSTITUTO TECNOLOGICO DIGITALES COMERCIALES II,96.62921348314607
"COLEGIO EDUCATIVO""LICDA. KIMBERLY MAZARIEGOS ENRÍQUEZ NO. 1","COLEGIO EDUCATIVO""LICDA. KIMBERLY MAZARIEGOS ENRIQUEZ NO. 3",96.61016949152543
"INSTITUTO NACIONAL DE EDUCACIÓN DIVERSIFICADA""SANTO DOMINGO",INSTITUTO NACIONAL DE EDUCACION DIVERSIFICADA SANTO DOMINGO,96.61016949152543
"COLEGIO EDUCATIVO""LICDA. KIMBERLY MAZARIEGOS ENRÍQUEZ NO. 2","COLEGIO EDUCATIVO""LICDA. KIMBERLY MAZARIEGOS ENRIQUEZ NO. 3",96.61016949152543
CENTRO EDUCATIVO PRIVADO MIXTO ACAZAU AZTLAN,"CENTRO EDUCATIVO PRIVADO MIXTO""ACAZAUAZTLAN",96.55172413793103
COLEGIO MIXTO PRIVADO ASDECHI,"COLEGIO MIXTO PRIVADO""ASDECHI",96.55172413793103
LICEO DE CIENCIA Y TECNOLOGÍA,LICEO DE CIENCIA Y TECNOLOGIA,96.55172413793103
INSTITUTO TECNOLOGICO PROESUR,INSTITUTO TECNOLÓGICO PROESUR,96.55172413793103
COLEGIO MIXTO NUEVA JERUSALÉN,"COLEGIO MIXTO""NUEVA JERUSALÉN",96.55172413793103
LICEO CRISTIANO SENDAS NUEVAS,"LICEO CRISTIANO""SENDAS NUEVAS",96.55172413793103
INSTITUTO PRIVADO MIXTO ELITE,"INSTITUTO PRIVADO MIXTO""ELITE",96.55172413793103
"CENTRO EDUCATIVO""MAYA SYSTEMS",CENTRO EDUCATIVO MAYA SYSTEMS,96.55172413793103
"COLEGIO PRIVADO MIXTO""GÉNESIS",COLEGIO PRIVADO MIXTO GÉNESIS,96.55172413793103
COLEGIO BILINGÜE MUNDO MÁGICO,"COLEGIO BILINGÜE""MUNDO MÁGICO",96.55172413793103
"COLEGIO MIXTO""CENTROAMERICANO",COLEGIO MIXTO CENTROAMERICANO,96.55172413793103
COLEGIO PRIVADO MIXTO PAMAXÁN,COLEGIO PRIVADO MIXTO PAMAXAN,96.55172413793103
"COLEGIO TECNOLÓGICO""JERUSALÉN",COLEGIO TECNOLÓGICO JERUSALÉN,96.55172413793103
"COLEGIO MIXTO""JUVENTUD ACTIVA",COLEGIO MIXTO JUVENTUD ACTIVA,96.55172413793103
"LICEO CRISTIANO""VISION ETERNA","LICEO CRISTIANO""VISIÓN ETERNA",96.55172413793103
"LICEO DE COMPUTACIÓN""SIGLO 21",LICEO DE COMPUTACIÓN SIGLO 21,96.55172413793103
INSTITUTO TÉCNICO DE CAPACITACIÓN Y PRODUCTIVIDAD INTECAP,INSTITUTO TECNICO DE CAPACITACION Y PRODUCTIVIDAD INTECAP,96.49122807017544
"INSTITUTO TECNOLÓGICO EN ESTUDIOS DIVERSIFICADOS""SAN JUAN",INSTITUTO TECNOLOGICO EN ESTUDIOS DIVERSIFICADOS SAN JUAN,96.49122807017544
COLEGIO PARTICULAR MIXTO SAN JOSÉ OBRERO I,COLEGIO PARTICULAR MIXTO SAN JOSE OBRERO II,96.47058823529412
"COLEGIO PARTICULAR MIXTO""SAN JOSE OBRERO II",COLEGIO PARTICULAR MIXTO SAN JOSE OBRERO I,96.47058823529412
"COLEGIO PARTICULAR MIXTO""SAN JOSÉ OBRERO II",COLEGIO PARTICULAR MIXTO SAN JOSÉ OBRERO I,96.47058823529412
"LICEO CRISTIANO CON ORIENTACION UNIVERSITARIA""EL SHADDAI","LICEO CRISTIANO CON ORIENTACION UNIVERSITARIA EL""SHADDAI",96.42857142857143
COLEGIO ADVENTISTA GETSEMANI,COLEGIO ADVENTISTA GETSEMANÍ,96.42857142857143
CENTRO EDUCATIVO REAL ESPAÑA,"CENTRO EDUCATIVO""REAL ESPAÑA",96.42857142857143
LICEO CLÁSICO EN COMPUTACIÓN,LICEO CLASICO EN COMPUTACIÓN,96.42857142857143
"COLEGIO""JOSÉ BATRES MONTÚFAR",COLEGIO JOSÉ BATRES MONTÚFAR,96.42857142857143
"CENTRO EDUCATIVO""MONTENEVADO",CENTRO EDUCATIVO MONTENEVADO,96.42857142857143
LICEO HISPANOAMERICANO NO. 3,LICEO HISPANOAMERICANO NO. 4,96.42857142857143
COLEGIO STHELLA DE HERNANDEZ,COLEGIO STHELLA DE HERNÁNDEZ,96.42857142857143
LICEO HISPANOAMERICANO NO. 2,LICEO HISPANOAMERICANO NO. 4,96.42857142857143
LICEO HISPANOAMERICANO NO. 2,LICEO HISPANOAMERICANO NO. 3,96.42857142857143
LICEO CLASICO EN COMPUTACIÓN,LICEO CLASICO DE COMPUTACIÓN,96.42857142857143
CENTRO EDUCATIVO EL PROGRESO,"CENTRO EDUCATIVO""EL PROGRESO",96.42857142857143
LICEO SAN JOSÉ DE LOS OLIVOS,LICEO SAN JOSE DE LOS OLIVOS,96.42857142857143
CENTRO DE FORMACIÓN TURÍSTICA E INFORMÁTICA LICEO TECPÁN,CENTRO DE FORMACIÓN TURISTICA E INFORMÁTICA LICEO TECPAN,96.42857142857143
COLEGIO TECNOLÓGICO CANALEÑO,COLEGIO TECNOLOGICO CANALEÑO,96.42857142857143
COLEGIO PARROQUIAL SAN PEDRO,"COLEGIO PARROQUIAL""SAN PEDRO",96.42857142857143
INSTITUTO MIXTO DE EDUCACIÓN FORTALEZA DEL FUTURO INMEFF,"INSTITUTO MIXTO DE EDUCACIÓN""FORTALEZA DEL FUTURO""INMEFF",96.42857142857143
COLEGIO STHELLA DE HERNANDEZ,"COLEGIO""STHELLA DE HERNANDEZ",96.42857142857143
COLEGIO MIXTO OXLAJU B AQTUN,COLEGIO MIXTO OXLAJU B'AQTUN,96.42857142857143
"CENTRO EDUCATIVO""MOPÁN""CEMOP","CENTRO EDUCATIVO""MOPAN""CEMOP",96.42857142857143
"INSTITUTO DE EDUCACIÓN A DISTANCIA""LA ESCUELA EN SU CASA",INSTITUTO DE EDUCACION A DISTANCIA LA ESCUELA EN SU CASA,96.42857142857143
LICEO CRISTIANO VERDAD L.C.V,"LICEO CRISTIANO VERDAD""L.C.V",96.42857142857143
"LICEO MIXTO CRISTIANO""PIAGET",LICEO MIXTO CRISTIANO PIAGET,96.42857142857143
TECNOLOGICO PREUNIVERSITARIO,TECNOLÓGICO PREUNIVERSITARIO,96.42857142857143
LICEO TECNICO DE VILLA NUEVA,LICEO TÉCNICO DE VILLA NUEVA,96.42857142857143
CENTRO ESTUDIANTIL FENIX CEF,"CENTRO ESTUDIANTIL FENIX""CEF",96.42857142857143
COLEGIO MIXTO CIENCIA Y ARTE,"COLEGIO MIXTO""CIENCIA Y ARTE",96.42857142857143
INSTITUTO MUNICIPAL DE EDUCACION BASICA Y DIVERSIFICADO,INSTITUTO MUNICIPAL DE EDUCACIÓN BÁSICA Y DIVERSIFICADO,96.36363636363636
"INSTITUTO PEDAGÓGICO DE EDUCACIÓN MEDIA SAN JOSÉ""IPEMSA","INSTITUTO PEDAGOGICO DE EDUCACIÓN MEDIA SAN JOSE""IPEMSA",96.36363636363636
LICEO TECNICO QUEZALTEPEQUE,LICEO TÉCNICO QUEZALTEPEQUE,96.2962962962963
COLEGIO TECNICO DE COMERCIO,COLEGIO TÉCNICO DE COMERCIO,96.2962962962963
COLEGIO SALESIANO DON BOSCO,"COLEGIO SALESIANO""DON BOSCO",96.2962962962963
"COLEGIO CRISTIANO""MARANATHA",COLEGIO CRISTIANO MARANATHA,96.2962962962963
COLEGIO MIXTO REAL EL VALLE,"COLEGIO MIXTO""REAL EL VALLE",96.2962962962963
LICEO CRISTIANO VERDAD L.C.V,LICEO CRISTIANO VERDAD LCV,96.2962962962963
"LICEO PRIVADO MIXTO""EMANUEL",LICEO PRIVADO MIXTO EMANUEL,96.2962962962963
CENTRO PEDAGÓGICO GUATEMALA,"CENTRO PEDAGÓGICO""GUATEMALA",96.2962962962963
CENTRO PEDAGOGICO GUATEMALA,CENTRO PEDAGÓGICO GUATEMALA,96.2962962962963
CENTRO EDUCATIVO INTEGRAL MIXTO FUENTE DE SAN JOSE FSJ,"CENTRO EDUCATIVO INTEGRAL MIXTO""FUENTE DE SAN JOSE""FSJ",96.2962962962963
"CENTRO DE ESTUDIOS TECNICOS Y AVANZADOS DE CHIMALTENANGO""C.E.T.A.CH.",CENTRO DE ESTUDIOS TÉCNICOS Y AVANZADOS DE CHIMALTENANGO C.E.T.A.CH,96.2962962962963
INSTITUTO DIVERSIFICADO POR COOPERATIVA,INSTITUTO DE DIVERSIFICADO POR COOPERATIVA,96.2962962962963
"COLEGIO PRIVADO MIXTO""JIREH",COLEGIO PRIVADO MIXTO JIREH,96.2962962962963
"INSTITUTO TECNOLOGICO PRIVADO MIXTO EVANGÉLICO""SUNESIS",INSTITUTO TECNOLÓGICO PRIVADO MIXTO EVANGÉLICO SUNESIS,96.2962962962963
INSTITUTO NACIONAL DE EDUCACION BASICA Y DIVERSIFICADO NUEVO AMANECER CON VISION,INSTITUTO NACIONAL DE EDUCACIÓN BÁSICA Y DIVERSIFICADO NUEVO AMANECER CON VISIÓN,96.25
COLEGIO PARTICULAR MIXTO NUESTRA SEÑORA DE CONCEPCION,"COLEGIO PARTICULAR MIXTO""NUESTRA SEÑORA DE CONCEPCIÓN",96.22641509433963
"INSTITUTO TÉCNICO DIVERSIFICADO ASOCIATIVA""AJ YICHKAN",INSTITUTO TECNICO DIVERSIFICADO ASOCIATIVA AJ YICHKAN,96.22641509433963
INSTITUTO PARTICULAR MIXTO DE EDUCACION BASICA Y DIVERSIFICADA DR. PEDRO MOLINA,"INSTITUTO PARTICULAR MIXTO DE EDUCACIÓN BÁSICA Y DIVERSIFICADA""DR. PEDRO MOLINA",96.20253164556962
COLEGIO PANAMERICANO NO. 4,COLEGIO PANAMERICANO NO. 6,96.15384615384616
COLEGIO PANAMERICANO NO. 6,COLEGIO PANAMERICANO NO. 3,96.15384615384616
INSTITUTO PRIVADO MIXTO DE COMPUTACIÓN INFORMÁTICA,INSTITUTO PRIVADO MIXTO DE COMPUTACIÓN INFORMÁTICA ICI,96.15384615384616
INSTITUTO MIXTO MUNICIPAL DE EDUCACIÓN DIVERSIFICADA,INSTITUTO MIXTO MUNICIPAL DE EDUCACION DIVERSIFICADO,96.15384615384616
"COLEGIO CIENTIFICO""GALILEO",COLEGIO CIENTIFICO GALILEO,96.15384615384616
CENTRO EDUCATIVO EL BOSQUE,"CENTRO EDUCATIVO""EL BOSQUE",96.15384615384616
"COLEGIO CIENTIFICO""GALILEO","COLEGIO CIENTÍFICO""GALILEO",96.15384615384616
COLEGIO PANAMERICANO NO. 4,COLEGIO PANAMERICANO NO. 3,96.15384615384616
INSTITUTO DE EDUCACIÓN DIVERSIFICADA POR COOPERATIVA,INSTITUTO DE EDUCACION DIVERSIFICADO POR COOPERATIVA,96.15384615384616
COLEGIO MIXTO SAN FERNANDO,"COLEGIO MIXTO""SAN FERNANDO",96.15384615384616
LICEO TECNOLÓGICO MAYA DE GUATEMALA II,LICEO TECNOLOGICO MAYA DE GUATEMALA III,96.1038961038961
COLEGIO INTEGRAL CIENCIA Y DESARROLLO,COLEGIO INTEGRAL CIENCIA Y DESARROLLO II,96.1038961038961
"COLEGIO MIXTO DE EDUCACIÓN MEDIA CMEM""EL INNOVADOR",COLEGIO MIXTO DE EDUCACION MEDIA CMEM EL INNOVADOR,96.0
"COLEGIO CRISTIANO""SHEKINA",COLEGIO CRISTIANO SHEKINA,96.0
COLEGIO PARAISO ESCONDIDO,COLEGIO PARAÍSO ESCONDIDO,96.0
CENTRO DE EDUCACIÓN EXTRAESCOLAR CEEX,CENTRO DE EDUCACION EXTRA ESCOLAR CEEX,96.0
COLEGIO EVANGÉLICO TECNOLÓGICO PRIVADO MIXTO BERSHEBA BLESS GOD,COLEGIO EVANGELCO TECNOLOGICO PRIVADO MIXTO BERSHEBA BLESS GOD,96.0
INSTITUTO NACIONAL DE EDUCACIÓN DIVERSIFICADA INED,INSTITUTO NACIONAL DE EDUCACION DIVERSIFICADO INED,96.0
"LICEO CRISTIANO""JERUSALEN",LICEO CRISTIANO JERUSALEN,96.0
"COLEGIO CRISTIANO""EMANUEL",COLEGIO CRISTIANO EMANUEL,96.0
"LICEO CRISTIANO""JERUSALEN","LICEO CRISTIANO""JERUSALÉN",96.0
COLEGIO EVANGÉLICO TECNOLÓGICO PRIVADO MIXTO BERSHEBA BLESS GOD,COLEGIO EVANGÉLICO TECNOLOGICO PRIVADO MIXTO BERSHEBA BISS GOD,96.0
"PROGRAMA NACIONAL DE EDUCACIÓN ALTERNATIVA , PRONEA",PROGRAMA NACIONAL DE EDUCACION ALTERNATIVA PRONEA,96.0
CENTRO EDUCATIVO SAN JOSÉ,"CENTRO EDUCATIVO""SAN JOSÉ",96.0
"COLEGIO PRIVADO MIXTO DE EDUCACION BASICA""EDUCARE","COLEGIO PRIVADO MIXTO DE EDUCACIÓN BÁSICA""EDUCARE",95.91836734693877
"PROGRAMA NACIONAL DE EDUCACION ALTERNATIVA, PRONEA",PROGRAMA NACIONA DE EDUCACIÓN ALTERNATIVA PRONEA,95.91836734693877
INSTITUTO TECNOLOGICO PARTICULAR MIXTO CONCEPCION,INSTITUTO TECNOLÓGICO PARTICULAR MIXTO CONCEPCIÓN,95.91836734693877
LICEO TECNOLÓGICO MAYA DE GUATEMALA,LICEO TECNOLÓGICO MAYA DE GUATEMALA II,95.89041095890411
"INSTITUTO DE EDUCACIÓN BÁSICA Y BACHILLERATO EN CIENCIAS Y LETRAS POR MADUREZ""DOCTOR JUAN JOSÉ ARÉVALO BERMEJO","INSTITUTO DE EDUCACIÓN BÁSICA Y BACHILLERATO EN CIENCIAS Y LETRAS POR MADUREZ""DR. JUAN JOSE AREVALO BERMEJO",95.85253456221197
LICEO DEL SUR LOS ALAMOS,LICEO DEL SUR LOS ÁLAMOS,95.83333333333334
"COLEGIO MIXTO""VALLE REAL",COLEGIO MIXTO VALLE REAL,95.83333333333334
"COLEGIO MIXTO""MONTE REAL",COLEGIO MIXTO MONTE REAL,95.83333333333334
COLEGIO EVANGÉLICO BELEN,COLEGIO EVANGÉLICO BELÉN,95.83333333333334
COLEGIO EVANGÉLICO BELÉN,"COLEGIO EVANGÉLICO""BELÉN",95.83333333333334
"INSTITUTO PRIVADO MIXTO""CENTRAL DE SUCHITEPÉQUEZ",INSTITUTO PRIVADO MIXTO CENTRAL DE SUCHITEPEQUEZ,95.83333333333334
COLEGIO AMOR Y SABIDURIA,"COLEGIO""AMOR Y SABIDURIA",95.83333333333334
"LICEO EVANGÉLICO""EL ALBA",LICEO EVANGÉLICO EL ALBA,95.83333333333334
CENTRO EDUCATIVO FE Y ALEGRIA NO. 1,CENTRO EDUCATIVO FE Y ALEGRIA NO. 49,95.77464788732395
CENTRO EDUCATIVO FE Y ALEGRÍA NO. 44,CENTRO EDUCATIVO FE Y ALEGRÍA NO. 2,95.77464788732395
CENTRO EDUCATIVO FE Y ALEGRÍA NO. 44,CENTRO EDUCATIVO FE Y ALEGRÍA NO. 6,95.77464788732395
COLEGIO PARTICULAR MIXTO LA BENDICION,COLEGIO PARTICULAR MIXTO BENDICION,95.77464788732395
CENTRO EDUCATIVO FE Y ALEGRÍA NO. 48,CENTRO EDUCATIVO FE Y ALEGRÍA NO. 2,95.77464788732395
CENTRO EDUCATIVO FE Y ALEGRÍA NO. 48,CENTRO EDUCATIVO FE Y ALEGRÍA NO. 6,95.77464788732395
CENTRO EDUCATIVO FE Y ALEGRIA NO. 1,CENTRO EDUCATIVO FE Y ALEGRIA NO. 22,95.77464788732395
CENTRO EDUCATIVO FE Y ALEGRÍA NO. 2,CENTRO EDUCATIVO FE Y ALEGRIA NO. 22,95.77464788732395
CENTRO EDUCATIVO FE Y ALEGRÍA NO. 7,CENTRO EDUCATIVO FE Y ALEGRÍA NO. 44,95.77464788732395
CENTRO EDUCATIVO FE Y ALEGRIA NO. 1,CENTRO EDUCATIVO FE Y ALEGRIA NO. 53,95.77464788732395
CENTRO EDUCATIVO FE Y ALEGRÍA NO. 48,CENTRO EDUCATIVO FE Y ALEGRÍA NO. 7,95.77464788732395
ESCUELA NORMAL PARA MAESTROS DE EDUCACION MUSICAL JESUS MARIA ALVARADO,"ESCUELA NORMAL PARA MAESTROS DE EDUCACIÓN MUSICAL""JESUS MARÍA ALVARADO",95.71428571428572
ESCUELA NORMAL PARA MAESTROS DE EDUCACION MUSICAL JESUS MARIA ALVARADO,ESCUELA NORMAL PARA MAESTROS DE EDUCACIÓN MUSICAL JESÚS MARÍA ALVARADO,95.71428571428572
"INSTITUTO PARTICULAR MIXTO DE FORMACIÓN Y DESARROLLO PROFESIONAL""INDEFORP","INSTITUTO PARTICULAR DE FORMACIÓN Y DESARROLLO PROFESIONAL""INDEFORP",95.71428571428572
INSTITUTO TÉCNICO DE CAPACITACIÓN Y PRODUCTIVIDAD INTECAP,"INSTITUTO TECNICO DE CAPACITACION Y PRODUCTIVIDAD, INTECAP",95.65217391304348
COLEGIO BILINGÜE CORBAN,COLEGIO BILINGÜE CORBÁN,95.65217391304348
INSTITUTO DE EDUCACIÓN ARTÍSTICA DEL SUR IDEAS,INSTITUTO DE EDUCACION ARTISTICA DEL SUR IDEAS,95.65217391304348
LICEO TECNOLÓGICO GALES,LICEO TECNOLOGICO GALES,95.65217391304348
"COLEGIO""LICEO MARQUENSE",COLEGIO LICEO MARQUENSE,95.65217391304348
COLEGIO EDUCATIVO DE DESARROLLO INFORMÁTICO Y CIENTÍFICO DE AMATITLÁN,COLEGIO EDUCATIVO DE DESARROLLO INFORMATICO Y CIENTIFICO DE AMATITLAN,95.65217391304348
"INSTITUTO PRIVADO TECNICO INDUSTRIAL""RETALTECO",INSTITUTO PRIVADO TÉCNICO INDUSTRIAL RETALTECO,95.65217391304348
COLEGIO INTERNACIONAL SEK GUATEMALA,COLEGIO INTERNACIONAL DE GUATEMALA,95.65217391304348
"COLEGIO PARTICULAR MIXTO""MIGUEL ÁNGEL ASTURIAS",COLEGIO PARTICULAR MIXTO MIGUEL ANGEL ASTURIAS,95.65217391304348
INSTITUTO MUNICIPAL DE EDUCACIÓN BÁSICA Y BACHILLERATO POR MADUREZ,INSTITUTO MIXTO MUNICIPAL DE EDUCACIÓN BÁSICA Y BACHILLERATO POR MADUREZ,95.65217391304348
"INSTITUTO PRIVADO MIXTO""JOSÉ CECILIO DEL VALLE",INSTITUTO PRIVADO MIXTO JOSE CECILIO DEL VALLE,95.65217391304348
LICEO TÉCNICO COMERCIAL,LICEO TECNICO COMERCIAL,95.65217391304348
"COLEGIO""SAGRADO CORAZON","COLEGIO""SAGRADO CORAZÓN",95.65217391304348
INSTITUTO DE EDUCACIÓN DIVERSIFICADA POR COOPERATIVA DE ENSEÑANZA,INSTITUTO MIXTO DE EDUCACIÓN DIVERSIFICADA POR COOPERATIVA DE ENSEÑANZA,95.58823529411765
INSTITUTO DE EDUCACION DIVERSIFICADA POR COOPERATIVA DE ENSEÑANZA,INSTITUTO MIXTO DE EDUCACION DIVERSIFICADA POR COOPERATIVA DE ENSEÑANZA,95.58823529411765
"INSTITUTO NACIONAL DE EDUCACION DIVERSIFICADA""ACATENANGO",INSTITUTO NACIONAL DE EDUCACION DIVERSIFICADA MAZATENANGO,95.57522123893806
"COLEGIO PARTICULAR MIXTO""CENTRO INTEGRAL SISTEMATICO CIS",COLEGIO PARTICULAR MIXTO CENTRO INTREGRAL SISTEMÁTICO CIS,95.57522123893806
INSTITUTO TECNOLOGICO EN ELECTRONICA Y DIBUJO,INSTITUTO TECNOLÓGICO EN ELECTRÓNICA Y DIBUJO,95.55555555555556
INSTITUTO NACIONAL DE EDUCACIÒN DIVERSIFICADA,INSTITUTO NACIONAL DE EDUCACION DIVERSIFICADO,95.55555555555556
INSTITUTO NACIONAL DE EDUCACION DIVERSIFICADA,INSTITUTO NACIONAL DE EDUCACIÓN DIVERSIFICADO,95.55555555555556
"COLEGIO PRIVADO URBANO MIXTO""BILINGÜE PARAÍSO",COLEGIO PRIVADO URBANO MIXTO BILINGÜE PARAISO,95.55555555555556
CENTRO TECNOLOGICO DE COMPUTACIÓN LA MERCED S.A,CENTRO TECNOLOGICO DE COMPUTACIÓN LA MERCED,95.55555555555556
INSTITUTO NACIONAL DE EDUCACIÒN DIVERSIFICADA,INSTITUTO NACIONAL DE EDUCACIÓN DIVERSIFICADO,95.55555555555556
"INSTITUTO TÉCNICO VOCACIONAL PRIVADO""EMILIANI",INSTITUTO TECNICO VOCACIONAL PRIVADO EMILIANI,95.55555555555556
INSTITUTO NACIONAL DE EDUCACIÓN DIVERSIFICADA,INSTITUTO NACIONAL DE EDUCACION DIVERSIFICADO,95.55555555555556
COLEGIO INTEGRAL TECNOLÓGICO CIENTÍFICO CITEC,COLEGIO INTEGRAL TECNOLOGICO CIENTIFICO CITEC,95.55555555555556
"COLEGIO PARTICULAR MIXTO TINTECO""MARÍA TERESA",COLEGIO PARTICULAR MIXTO TINTECO MARIA TERESA,95.55555555555556
LICEO MIXTO TÉCNICO EN COMPUTACIÓN SENDA 2000,"LICEO MIXTO TECNICO EN COMPUTACIÓN""SENDA 2000",95.55555555555556
"LICEO DE COMPUTACIÓN C.S.S, ZONA 6",LICEO DE COMPUTACIÓN C.S.S ZONA 7,95.52238805970148
"CENTRO EDUCATIVO INTEGRAL,""FAGIOLI",CENTRO EDUCATIVO INTEGRAL FAGIOLI,95.52238805970148
"INSTITUTO PARTICULAR FORMACIÓN Y DESARROLLO PROFESIONAL""INDEFORP II","INSTITUTO PARTICULAR DE FORMACIÓN Y DESARROLLO PROFESIONAL""INDEFORP",95.52238805970148
LICEO INTERCULTURAL DE GUATEMALA,LICEO INTERCULTURAL DE GUATEMALA II,95.52238805970148
"INSTITUTO PRIVADO MIXTO DE COMPUTACIÓN INFORMÁTICA""I.C.I.",INSTITUTO PRIVADO MIXTO DE COMPUTACIÓN INFORMÁTICA ICI,95.4954954954955
PROGRAMA MODALIDADES FLEXIBLES PARA LA EDUCACIÓN MEDIA,PROGRAMA DE MODALIDADES FLEXIBLES PARA LA EDUCACION MEDIA,95.4954954954955
LICEO TÉCNICO INTEGRAL,LICEO TECNICO INTEGRAL,95.45454545454545
COLEGIO CRISTIANO ELIM,"COLEGIO CRISTIANO""ELIM",95.45454545454545
"INSTITUTO TÉCNICO INDUSTRIAL""ALBERT EINSTEIN",INSTITUTO TECNICO INDUSTRIAL ALBERT EINSTEIN,95.45454545454545
ESCUELA NORMAL BILINGÜE INTERCULTURAL KITIJOB AL K ICHE TIJONELAB,ESCUELA NORMAL BILINGÜE INTERCULTURAL KITIJOB´AL K´ICHE´ TIJONELAB´,95.45454545454545
LICEO MIXTO SAN MIGUEL,"LICEO MIXTO""SAN MIGUEL",95.45454545454545
"COLEGIO MIXTO""SAN JOSÉ",COLEGIO MIXTO SAN JOSÉ,95.45454545454545
LICEO NUEVA GENERACION,LICEO NUEVA GENERACIÓN,95.45454545454545
"COLEGIO MIXTO""SAN JOSE",COLEGIO MIXTO SAN JOSE,95.45454545454545
COLEGIO MIXTO SAN JOSÉ,COLEGIO MIXTO SAN JOSE,95.45454545454545
COLEGIO VALVERDE NO. 2,COLEGIO VALVERDE NO. 3,95.45454545454545
LICEO TECNICO INTEGRAL SANTA TERESA DE JESUS,LICEO TÉCNICO INTEGRAL SANTA TERESA DE JESÚS,95.45454545454545
"COLEGIO MIXTO""SAN JOSÉ","COLEGIO MIXTO""SAN JOSE",95.45454545454545
COLEGIO DE ESTUDIOS TECNICOS ESPECIALIZADOS EN COMPUTACIÓN CETESC,"COLEGIO DE""ESTUDIOS TECNICOS ESPECIALIZADOS EN COMPUTACIÓN""(CETESC)",95.45454545454545
"CENTRO DE ESTUDIOS""TÉCNICO JUVENIL EDUCATIVO",CENTRO DE ESTUDIOS TECNICO JUVENIL EDUCATIVO,95.45454545454545
ESCUELA NORMAL BILINGÜE INTERCULTURAL K´ ICHE´ TIJOB´ ÄL UTÜX MAYAB´ WINÄQ OXLAJUJ TZ´ I´,ESCUELA NORMAL BILINGÜE INTERCULTURAL K´ICHE´ TIJOB´AL UTUX MAYAB´ WINAQ OXLAJUJ TZ´ I´,95.45454545454545
COLEGIO DE INTELIGENCIAS MULTIPLES,COLEGIO INTELIGENCIAS MULTIPLES,95.38461538461537
COLEGIO PRIVADO MIXTO AMERICANO,COLEGIO PRIVADO MIXTO PANAMERICANO,95.38461538461537
INSTITUTO PRIVADO MIXTO CIENTÍFICO INTEGRAL,"INSTITUTO PRIVADO MIXTO""CIENTIFICO INTEGRAL",95.34883720930233
INSTITUTO NORMAL PARA SEÑORITAS DE ORIENTE,INSTITUTO NORMAL PARA SEÑORITAS DE OCCIDENTE,95.34883720930233
"COLEGIO PARTICULAR MIXTO""SAN JOSÉ OBRERO II",COLEGIO PARTICULAR MIXTO SAN JOSE OBRERO II,95.34883720930233
INSTITUTO TECNOLÓGICO PRIVADO DE COATEPEQUE,"INSTITUTO TECNOLOGICO PRIVADO DE""COATEPEQUE",95.34883720930233
INSTITUTO PRIVADO TÉCNICO INDUSTRIAL QUICHÉ,INSTITUTO PRIVADO TECNICO INDUSTRIAL QUICHE,95.34883720930233
"INSTITUTO PARTICULAR MIXTO""MARÍA CHINCHILLA",INSTITUTO PARTICULAR MIXTO MARIA CHINCHILLA,95.34883720930233
"LICEO FORMACIÓN BASICA Y PROFESIONAL""LATINOAMERICANO",LICEO DE FORMACIÓN BASICA Y PROFESIONAL LATINOAMERICANO,95.32710280373831
INSTITUTO DE EDUCACIÓN BÁSICA BILINGÜE INTERCULTURAL LA TRINIDAD,"INSTITUTO DE EDUCACION BASICA BILINGÜE INTERCULTURAL""LA TRINIDAD",95.3125
LICEO TECNOLOGICO GUATEMALA DE LA ASUNCION,LICEO TECNOLÓGICO GUATEMALA DE LA ASUNCIÓN,95.23809523809523
"COLEGIO PRIVADO MIXTO""JACOBO ARBENZ GUZMAN",COLEGIO PRIVADO MIXTO JACOBO ARBENZ GUZMÁN,95.23809523809523
COLEGIO EVANGÉLICO MIXTO SINAI,COLEGIO EVANGÉLICO MIXTO SINAI II,95.23809523809523
COLEGIO TÉCNICO SUIZO,COLEGIO TECNICO SUIZO,95.23809523809523
"COLEGIO""JUAN PABLO II",COLEGIO JUAN PABLO II,95.23809523809523
"COLEGIO""SAN FRANCISCO",COLEGIO SAN FRANCISCO,95.23809523809523
COLEGIO EVANGÉLICO TECNOLOGICO PRIVADO MIXTO BERSHEBA BISS GOD,COLEGIO EVANGELCO TECNOLOGICO PRIVADO MIXTO BERSHEBA BLESS GOD,95.16129032258065
INSTITUTO PRIVADO RAFAÉN ARÉVALO MARTÍNEZ,INSTITUTO PRIVADO RAFAEL ARÉVALO MARTÍNEZ,95.1219512195122
"COLEGIO MIXTO BILINGÜE INTERCULTURAL""Q´IJ",COLEGIO MIXTO BILINGÜE INTERCULTURAL Q IJ,95.1219512195122
"CENTRO EDUCATIVO A""DISTANCIA AULA VIRTUAL","CENTRO EDUCATIVO A DISTANCIA""AULA VIRTUAL",95.1219512195122
"INSTITUTO MIXTO DE EDUCACION""CONGUAQUENSE",INSTITUTO MIXTO DE EDUCACIÓN CONGUAQUENSE,95.1219512195122
"COLEGIO PARTICULAR MIXTO""MATÍAS DE GÁLVEZ","COLEGIO PARTICULAR MIXTO""MATIAS DE GALVEZ",95.1219512195122
INSTITUTO TECNOLÓGICO PRIVADO DE ORIENTE,INSTITUTO TECNOLÓGICO PRIVADO DE OCCIDENTE,95.1219512195122
"CENTRO EDUCATIVO TÉCNICO PORTILLO""CETPORT",CENTRO EDUCATIVO TECNICO PORTILLO CETPORT,95.1219512195122
COLEGIO DE INFORMÁTICA IMB PC #1,COLEGIO DE INFORMÁTICA IMB PC,95.08196721311475
INSTITUTO NACIONAL DE EDUCACION DIVERSIFICADO INED,"INSTITUTO NACIONAL DE EDUCACIÓN DIVERSIFICADA, INED",95.04950495049505
COLEGIO IMB PC NO. 8,COLEGIO IMB PC NO. 7,95.0
COLEGIO PARTICULAR MIXTO SAGRADO CORAZON,"COLEGIO PARTICULAR MIXTO""SAGRADO CORAZÓN",95.0
LICEO ALVAREZ OVALLE,"LICEO""ALVAREZ OVALLE",95.0
COLEGIO MESOAMERICANO,COLEGIO MESOAMERICA,95.0
ESCUELA PRIVADA MIXTA EVANGELICA SHEKINA,ESCUELA PRIVADA MIXTA EVANGÉLICA SHEKINÁ,95.0
INSTITUTO TECNOLOGICO DE COMPUTACIÓN DE ORIENTE ITCO,INSTITUTO TECNOLOGICO DE COMPUTACIÓN DE ORIENTE,94.94949494949495
"COLEGIO PRIVADO MIXTO""EMMANUEL",COLEGIO PRIVADO MIXTO EMANUEL,94.91525423728814
INSTITUTO DE EDUCACIÓN DIVERSIFICADA POR COOPERATIVA DE ENSEÑANZA,"INSTITUTO DE EDUCACIÓN DIVERSIFICADA POR COOPERATIVA DE ENSEÑANZA""SAQB´E",94.8905109489051
"COLEGIO""FORMACIÓN INTEGRAL DE AMATITLAN",COLEGIO FORMACIÓN INTEGRAL DE AMATITLÁN,94.87179487179486
COLEGIO CENTRO DE ESTUDIOS INTEGRALES,COLEGIO CENTRO DE ESTUDIOS INTEGRALES CEI,94.87179487179486
"CENTRO DE DESARROLLO EDUCATIVO SAN""JOSÉ",CENTRO DE DESARROLLO EDUCATIVO SAN JOSE,94.87179487179486
"INSTITUTO TECNICO INDUSTRIAL""HENRY FORD",INSTITUTO TÉCNICO INDUSTRIAL HENRY FORD,94.87179487179486
INSTITUTO MUNICIPAL DE EDUCACIÓN BÁSICA,INSTITUTO MUNICIPAL DE EDUCACION BASICA,94.87179487179486
"INSTITUTO TÉCNICO INDUSTRIAL""HENRY FORD",INSTITUTO TECNICO INDUSTRIAL HENRY FORD,94.87179487179486
INSTITUTO TÉCNICO MARÍTIMO BANAPORT C.A,INSTITUTO TECNICO MARITIMO BANAPORT C.A,94.87179487179486
ESCUELA NACIONAL DE CIENCIAS COMERCIALES NO. 3 J. N,ESCUELA NACIONAL DE CIENCIAS COMERCIALES NO. 3,94.84536082474226
TECNOLÓGICO PREUNIVERSITARIO,TECNOLOGICO PRE UNIVERSITARIO,94.73684210526316
"CENTRO TECNOLOGICO DE COMPUTACIÓN""LA MERCED""S. A",CENTRO TECNOLOGICO DE COMPUTACIÓN LA MERCED S.A,94.73684210526316
COLEGIO CRISTIANO TERRANOVA,COLEGIO CRISTIANO TERRANOVA II,94.73684210526316
INSTITUTO NACIONAL DE EDUCACION DIVERSIFICADA,INSTITUTO NACIONAL DE EDUCACION DIVERSIFICADA INED,94.73684210526316
INSTITUTO PRIVADO DE EDUCACION MIXTA CIENCIA Y TECNOLOGIA,"INSTITUTO PRIVADO DE EDUCACIÓN MIXTA""CIENCIA Y TECNOLOGÍA",94.73684210526316
COLEGIO MIXTO OXLAJU B AQTUN,COLEGIO MIXTO OXLAJUJ B´AQTUN,94.73684210526316
INSTITUTO NACIONAL DE EDUCACION DIVERSIFICADO INED,INSTITUTO NACIONAL DE EDUCACION DIVERSIFICADO,94.73684210526316
COLEGIO MONTE VERDE,"COLEGIO""MONTE VERDE",94.73684210526316
INSTITUTO PRIVADO MIXTO ELITE,INSTITUTO PRIVADO MIXTO MEIT,94.73684210526316
COLEGIO MIXTO OXLAJUJ B´AQTUN,COLEGIO MIXTO OXLAJU B'AQTUN,94.73684210526316
COLEGIO LA ASUNCION,COLEGIO LA ASUNCIÓN,94.73684210526316
INSTITUTO NACIONAL DE EDUCACIÓN DIVERSIFICADA,INED INSTITUTO NACIONAL DE EDUCACIÓN DIVERSIFICADA,94.73684210526316
"COLEGIO PARTICULAR MIXTO""SAN CRISTÓBAL",COLEGIO PARTICULAR MIXTO SAN CRISTOBAL,94.73684210526316
LICEO SAN CRISTOBAL,LICEO SAN CRISTÓBAL,94.73684210526316
ASOCIACIÓN DE MAESTROS DE EDUCACIÓN RURAL DE GUATEMALA AMERG,ASOCIACIÓN DE MAESTROS DE EDUCACIÓN RURAL DE GUATEMALA,94.73684210526316
TECNOLÓGICO MODERNO CENTRO EDUCACIONAL,"TECNOLOGICO MODERNO""CENTRO EDUCACIONAL",94.73684210526316
INSTITUTO NACIONAL DE EDUCACIÓN DIVERSIFICADA,INSTITUTO NACIONAL DE EDUCACIÓN DIVERSIFICADA INED,94.73684210526316
INSTITUTO MIXTO DE EDUCACION DIVERSIFICADA POR COOPERATIVA DE ENSEÑANZA,INSTITUTO MIXTO DE EDUCACION DIVERSIFICADA POR COOPERATIVA DE ENSEÑANZA SIBILIA,94.66666666666667
INSTITUTO MUNICIPAL DE EDUCACION BASICA Y BACHILLERATO POR MADUREZ,INSTITUTO MUNICIPAL DE EDUCACION MEDIA Y BACHILLERATO POR MADUREZ,94.65648854961832
INSTITUTO MUNICIPAL DE EDUCACIÓN BÁSICA Y BACHILLERATO POR MADUREZ,INSTITUTO NACIONAL DE EDUCACIÓN BÁSICA Y BACHILLERATO POR MADUREZ,94.65648854961832
INSTITUTO MUNICIPAL DE EDUCACIÓN BÁSICA Y BACHILLERATO POR MADUREZ,INSTITUTO MUNICIPAL DE EDUCACIÓN MEDIA Y BACHILLERATO POR MADUREZ,94.65648854961832
ESCUELA NACIONAL DE CIENCIAS COMERCIALES SECCION DIURNA,ESCUELA NACIONAL DE CIENCIAS COMERCIALES SECCION NOCTURNA,94.64285714285714
"LICEO CRISTIANO CON ORIENTACIÓN UNIVERSITARIA""EL SHADDAI","LICEO CRISTIANO CON ORIENTACION UNIVERSITARIA EL""SHADDAI",94.64285714285714
CENTRO DE EDUCACIÓN EXTRAESCOLAR GRUPO CEIBA,CENTRO DE EDUCACIÓN EXTRAESCOLAR CEEX GRUPO CEIBA,94.6236559139785
COLEGIO EN COMPUTACIÓN SAN JOSE NO. 2,COLEGIO EN COMPUTACIÓN SAN JOSÉ NO. 1,94.5945945945946
"COLEGIO PARTICULAR MIXTO""LA ENSEÑANZA","COLEGIO PARTICULAR MIXTO""LA ESPERANZA",94.5945945945946
"COLEGIO DE EDUCACION MEDIA""SAN ISIDRO",COLEGIO DE EDUCACIÓN MEDIA SAN ISIDRO,94.5945945945946
